timestamp,tweet_text,username,all_hashtags,followers_count
2020-02-22 21:00:31,"IS THIS THE END ?! 😷 ""Fears of a global #coronavirus pandemic as cases of reported infections surge"" #wuhan  https://t.co/wDVJc6KkzW",PRAISETRIUNEGOD,"['coronavirus', 'wuhan']",12222
2020-02-22 21:00:22,"We are still talking about building 19 hospitals in the same city , #Wuhan a city of 8.9 mln   #Canada  🙄🙄🙄🙄  #COVID19 #SARSCoV2 #Coronavirus #nCoV2019 #pandemic #Epidemic",K_B79,"['Wuhan', 'Canada', 'COVID19', 'SARSCoV2', 'Coronavirus', 'nCoV2019', 'pandemic', 'Epidemic']",2645
2020-02-22 21:00:18,Microbiologists and virologists decline to state explicitly that #COVID19 is or is not a bioweapon. We should decline to fill that gap in their stead.  https://t.co/3JvyOk13jk  #coronavirus #China #Wuhan #virus https://t.co/NAS86E6keC,TheVoiceOfLibe3,"['COVID19', 'coronavirus', 'China', 'Wuhan', 'virus']",1414
2020-02-22 21:00:04,Check out this Amazon deal: Clorox 02176 500 ml Hand Sanitizing Spray Bottle (Case of 12) https://t.co/GlMzbj62wX  #ad #coronavirus #coronaoutbreak #flu #corona #virus #CoronavirusOutbreak #coronaviruswuhan #2019nCoV #COVID19 #wuhan #china #outbreak #CoronavirusUSA #pandemic,mystylehfb,"['ad', 'coronavirus', 'coronaoutbreak', 'flu', 'corona', 'virus', 'CoronavirusOutbreak', 'coronaviruswuhan', '2019nCoV', 'COVID19', 'wuhan', 'china', 'outbreak', 'CoronavirusUSA', 'pandemic']",5698
2020-02-22 21:00:00,Coronavirus Outbreak China: Man runs a marathon inside his apartment amidst lockdown... #Coronavirus #Wuhan #China #COVID #CoronavirusOutbreak #CoronavirusChina #Corona #WuhanCoronavirus #COVID19 https://t.co/hPGlqbc4jf,TPE_connect,"['Coronavirus', 'Wuhan', 'China', 'COVID', 'CoronavirusOutbreak', 'CoronavirusChina', 'Corona', 'WuhanCoronavirus', 'COVID19']",632
2020-02-22 20:59:03,"3M Rugged Comfort Half Facepiece Reusable Respirator 6502/49489, Medium https://t.co/cD2SdVzbUx #ad #coronavirus #coronaoutbreak #flu #corona #virus #CoronavirusOutbreak #coronaviruswuhan #2019nCoV #COVID19 #wuhan #china #outbreak #CoronavirusUSA #pandemic",mystylehfb,"['ad', 'coronavirus', 'coronaoutbreak', 'flu', 'corona', 'virus', 'CoronavirusOutbreak', 'coronaviruswuhan', '2019nCoV', 'COVID19', 'wuhan', 'china', 'outbreak', 'CoronavirusUSA', 'pandemic']",5698
2020-02-22 20:58:14,"Germ-X Hand Sanitizer, Original, Pump Bottle, 30 Fluid Ounce (Pack of 4) https://t.co/JdJocuf1Uu #ad #coronavirus #coronaoutbreak #flu #corona #virus #CoronavirusOutbreak #coronaviruswuhan #2019nCoV #COVID19 #wuhan #china #outbreak #CoronavirusUSA #pandemic",mystylehfb,"['ad', 'coronavirus', 'coronaoutbreak', 'flu', 'corona', 'virus', 'CoronavirusOutbreak', 'coronaviruswuhan', '2019nCoV', 'COVID19', 'wuhan', 'china', 'outbreak', 'CoronavirusUSA', 'pandemic']",5698
2020-02-22 20:57:47,"Alcohol Prep Pads, Medium 2-Ply-400 Wipes, Individually Wrapped,  70% v/v Isopropyl Alcohol https://t.co/ikmpVhkO6J #ad #coronavirus #coronaoutbreak #flu #corona #virus #CoronavirusOutbreak #coronaviruswuhan #2019nCoV #COVID19 #wuhan #china #outbreak #CoronavirusUSA #pandemic",mystylehfb,"['ad', 'coronavirus', 'coronaoutbreak', 'flu', 'corona', 'virus', 'CoronavirusOutbreak', 'coronaviruswuhan', '2019nCoV', 'COVID19', 'wuhan', 'china', 'outbreak', 'CoronavirusUSA', 'pandemic']",5698
2020-02-22 20:53:54,"The supports from these lovelies R incredible🎁 in humanity. They are REAL ASSETS &amp;☀️of this🗺  Generosity means also showing KINDNESS thru mind, ♥️, speech &amp; attitude. It makes us WEALTHIER as a person.   #wuhan #china #wuhanjiayou #usa #uk #africa #canada #COVID19 #coronavirus https://t.co/hNEzkEQsRV",ArtNBook,"['wuhan', 'china', 'wuhanjiayou', 'usa', 'uk', 'africa', 'canada', 'COVID19', 'coronavirus']",122
2020-02-22 20:53:25,"Student from Shanghai 2day w/ doctor father:  ""It seems there’s a new development, teacher. They are telling doctors now that it is dormant for a few weeks, then sometimes kills the victim suddenly. They don’t even know they are sick before they drop dead.” #wuhan #coronavirus https://t.co/7NgLUf12GT",CavinGraves,"['wuhan', 'coronavirus']",118
2020-02-22 20:53:04,"Sellstrom Single Crown Safety Face Shield with Ratchet Headgear, Shade 5, Uncoated, Black https://t.co/KWwDxjkjLk  #ad #coronavirus #coronaoutbreak #flu #corona #virus #CoronavirusOutbreak #coronaviruswuhan #2019nCoV #COVID19 #wuhan #china #outbreak #CoronavirusUSA #pandemic",mystylehfb,"['ad', 'coronavirus', 'coronaoutbreak', 'flu', 'corona', 'virus', 'CoronavirusOutbreak', 'coronaviruswuhan', '2019nCoV', 'COVID19', 'wuhan', 'china', 'outbreak', 'CoronavirusUSA', 'pandemic']",5698
2020-02-22 20:52:47,That many bodies on just one side of two blocks....THE CHINESE GOVERNMENT IS LYING TO THE WORLD. #WakeUp #Wuhan  #coronavirus #CoronavirusOutbreak https://t.co/I2Ks0hRZko,SaintBrothel,"['WakeUp', 'Wuhan', 'coronavirus', 'CoronavirusOutbreak']",2627
2020-02-22 20:51:49,"Kimberly-Clark KleenGuard Polypropylene Light Duty Coverall, Disposable, Elastic Wrist (25) https://t.co/vaEJITNMK7  #ad #coronavirus #coronaoutbreak #flu #corona #virus #CoronavirusOutbreak #coronaviruswuhan #2019nCoV #COVID19 #wuhan #china #outbreak #CoronavirusUSA #pandemic",mystylehfb,"['ad', 'coronavirus', 'coronaoutbreak', 'flu', 'corona', 'virus', 'CoronavirusOutbreak', 'coronaviruswuhan', '2019nCoV', 'COVID19', 'wuhan', 'china', 'outbreak', 'CoronavirusUSA', 'pandemic']",5698
2020-02-22 20:51:44,@RayMacDonald16 @Imamofpeace I am surprised they have admitted 6 deaths #COVID19 #COVID #coronavirus #wuhan #Iran,BoazDorset,"['COVID19', 'COVID', 'coronavirus', 'wuhan', 'Iran']",47
2020-02-22 20:49:53,3M 65021HA1-C Household Multi-Purpose Respirator https://t.co/CeYLwrb6hv #ad #coronavirus #coronaoutbreak #flu #corona #virus #CoronavirusOutbreak #coronaviruswuhan #2019nCoV #COVID19 #wuhan #china #outbreak #CoronavirusUSA #pandemic,mystylehfb,"['ad', 'coronavirus', 'coronaoutbreak', 'flu', 'corona', 'virus', 'CoronavirusOutbreak', 'coronaviruswuhan', '2019nCoV', 'COVID19', 'wuhan', 'china', 'outbreak', 'CoronavirusUSA', 'pandemic']",5698
2020-02-22 20:49:15,"3M 8511 Respirator, N95, Cool Flow Valve (10-Pack) https://t.co/x1bUSbv5Ui #ad #coronavirus #coronaoutbreak #flu #corona #virus #CoronavirusOutbreak #coronaviruswuhan #2019nCoV #COVID19 #wuhan #china #outbreak #CoronavirusUSA #pandemic",mystylehfb,"['ad', 'coronavirus', 'coronaoutbreak', 'flu', 'corona', 'virus', 'CoronavirusOutbreak', 'coronaviruswuhan', '2019nCoV', 'COVID19', 'wuhan', 'china', 'outbreak', 'CoronavirusUSA', 'pandemic']",5698
2020-02-22 20:46:56,"“Does that suggest to you that the novel #coronavirus, now known as SARS-CoV-2, may have escaped from that very lab, and that Gen. Chen’s job is to try and put the genie back in the bottle, as it were? It does to me.” #Wuhan #武汉 #WuhanInstituteOfVirology https://t.co/mPs2PcHnxn",good_karma_bon,"['coronavirus', 'Wuhan', '武汉', 'WuhanInstituteOfVirology']",391
2020-02-22 20:46:10,Hundreds of residents and workers who came into contact with 54 people who tested positive for the virus in Italy were put into isolation pending results of their tests.  #Wuhan #WuhanCoronavirus #Coronavirus #COVID19   https://t.co/rjp2MAn7kN,sa_nightingale,"['Wuhan', 'WuhanCoronavirus', 'Coronavirus', 'COVID19']",12084
2020-02-22 20:44:12,Children are not immune to #Coronavirus. There have not been many reported cases in children from #China. Appears it is really effecting children in #Iran 🥺 God be with us all!  #WakeUpAmerica #USA #America #US #Canada #COVID19 #Wuhan @CDCgov #Doctor #Nurse #coronavirusitalIa https://t.co/lJHWWbQEEj,AngieBlu7,"['Coronavirus', 'China', 'Iran', 'WakeUpAmerica', 'USA', 'America', 'US', 'Canada', 'COVID19', 'Wuhan', 'Doctor', 'Nurse', 'coronavirusitalIa']",91
2020-02-22 20:41:45,"Japan's health minister said Saturday that 23 passengers were released from the Diamond Princess cruise ship without being tested for the new virus due to procedural mistakes,  #Wuhan #WuhanCoronavirus #Coronavirus #COVID19   https://t.co/AG1UuKBPbe",sa_nightingale,"['Wuhan', 'WuhanCoronavirus', 'Coronavirus', 'COVID19']",12084
2020-02-22 20:41:23,Barricaded #Quarantine Apartment Doors in #Wuhan #China.  #coronavirus #WuhanCoronavirus https://t.co/sW0Ohw8FmW,AldoGiammusso,"['Quarantine', 'Wuhan', 'China', 'coronavirus', 'WuhanCoronavirus']",274
2020-02-22 20:40:15,#coronavirus showG up in #iran with no direct link to #Wuhan - @cnnbrk @tonydokoupil @esaagar @drsanjaygupta https://t.co/AJuT9An6or,Astrologic007,"['coronavirus', 'iran', 'Wuhan']",2309
2020-02-22 20:40:06,"🚨Suggest You Read🚨  ⬇️This article⬇️ *(I'm not buying what China is attempting to sell us about origin of  this deadly virus...-Smh) Read-&gt; #Coronavirus &amp; origins of how it started in #Wuhan #China ...Home of China's ""Virolent Virus Research Laboratory""  https://t.co/vmbDLTlGKK",K3Olady,"['Coronavirus', 'Wuhan', 'China']",429
2020-02-22 20:34:51,(Matthew 24:7) #China: #Wuhan woman with no symptoms infects five relatives with coronavirus https://t.co/EjNrUExQFa #EndTimes #WorldNews #news #coronavirus https://t.co/2JY9GryjEQ,TheLastDays777,"['China', 'Wuhan', 'EndTimes', 'WorldNews', 'news', 'coronavirus']",1908
2020-02-22 20:32:56,The #coronavirus is hard to contain. Here's why. https://t.co/jDCCgU1IOp #PANDEMIC  #China #France #Japan #wuhan #SouthKorea #Singapore #Thailand #Australia #breaking #breakingnews #HongKongProtests #Macau #India  #Italy #Iran  #USA  #TrumpVisitIndia,deadlyfodz,"['coronavirus', 'PANDEMIC', 'China', 'France', 'Japan', 'wuhan', 'SouthKorea', 'Singapore', 'Thailand', 'Australia', 'breaking', 'breakingnews', 'HongKongProtests', 'Macau', 'India', 'Italy', 'Iran', 'USA', 'TrumpVisitIndia']",126
2020-02-22 20:32:35,IF 25% of #coronavirus patients end up in the ICU and 50% of those die as this #Wuhan research suggests we’re looking at 12.5% mortality rate.  #Covid19 #SARSCoV2 https://t.co/c3jHDFk6FX,NetworksManager,"['coronavirus', 'Wuhan', 'Covid19', 'SARSCoV2']",107433
2020-02-22 20:32:27,"South Korea reported 229 new cases of the coronavirus on Saturday, the largest spike in a single day since its first outbreak in late January, bringing the total number of infections in the nation to 433.  #Wuhan #WuhanCoronavirus #Coronavirus #COVID19   https://t.co/jfQxtjNpRF",sa_nightingale,"['Wuhan', 'WuhanCoronavirus', 'Coronavirus', 'COVID19']",12084
2020-02-22 20:32:00,#COVIDー19 #COVID2019 #WUHAN Immune Kit #ProtectYourself https://t.co/4oSAmr9A8B 🇺🇸 https://t.co/fifr2CX142 🇨🇦  H5N1: Iran: 10 new COVID-19 cases reported https://t.co/mpEIuCskcd #coronavirus #covid19,AGNCanada,"['COVIDー19', 'COVID2019', 'WUHAN', 'ProtectYourself', 'coronavirus', 'covid19']",1126
2020-02-22 20:32:00,#COVID2019 #COVIDー19 #WUHAN Silver Biotics #ProtectYourself https://t.co/Bmyy7EG5q2 🇺🇸 https://t.co/WUDb1WT15u 🇨🇦  H5N1: China: Presumed asymptomatic carrier transmission of COVID-19 https://t.co/O3OK0a2Az7 #coronavirus #covid19,AGNCanada,"['COVID2019', 'COVIDー19', 'WUHAN', 'ProtectYourself', 'coronavirus', 'covid19']",1126
2020-02-22 20:31:19,‘as the Chinese Ministry of Science and Technology released a new directive entitled: “Instructions on strengthening biosecurity management in microbiology labs that handle advanced viruses like the novel #coronavirus.”’ #Wuhan #WuhanInstituteOfVirology https://t.co/mPs2PcHnxn,good_karma_bon,"['coronavirus', 'Wuhan', 'WuhanInstituteOfVirology']",391
2020-02-22 20:30:15,Life in #Wuhan makeshift hospital #COVID19 #coronavirus https://t.co/gIwukeZzzY,ChinaDaily,"['Wuhan', 'COVID19', 'coronavirus']",4287538
2020-02-22 20:30:06,Pandemic Kit for Individual https://t.co/jVoxmrlWJH  #ad #coronavirus #coronaoutbreak #flu #corona #virus #CoronavirusOutbreak #coronaviruswuhan #2019nCoV #COVID19 #wuhan #china #outbreak #CoronavirusUSA #pandemic,mystylehfb,"['ad', 'coronavirus', 'coronaoutbreak', 'flu', 'corona', 'virus', 'CoronavirusOutbreak', 'coronaviruswuhan', '2019nCoV', 'COVID19', 'wuhan', 'china', 'outbreak', 'CoronavirusUSA', 'pandemic']",5698
2020-02-22 20:30:00,"A totally normal flu season with an army of sanitizing trucks - spraying, fogging the streets of China with chemicals every day, every night.  #COVID #COVID19 #China #wuhan #冠状病毒 #coronavirus #CoronavirusOutbreak #Wuhan #coronaviruschina #coronavirusaustralia",RoutVanna,"['COVID', 'COVID19', 'China', 'wuhan', '冠状病毒', 'coronavirus', 'CoronavirusOutbreak', 'Wuhan', 'coronaviruschina', 'coronavirusaustralia']",479
2020-02-22 20:29:47,#Coronavirus outbreak edges closer to #pandemic https://t.co/uDvVRLeeqU #Coronavirus PANDEMIC  #China #France #Japan #wuhan #SouthKorea #Singapore #Thailand #Australia #breaking #breakingnews #HongKongProtests #Macau #Malaysia #Canada #Italy #Iran  #USA  #TrumpVisitIndia,deadlyfodz,"['Coronavirus', 'pandemic', 'Coronavirus', 'China', 'France', 'Japan', 'wuhan', 'SouthKorea', 'Singapore', 'Thailand', 'Australia', 'breaking', 'breakingnews', 'HongKongProtests', 'Macau', 'Malaysia', 'Canada', 'Italy', 'Iran', 'USA', 'TrumpVisitIndia']",126
2020-02-22 20:28:49,"@leannebug @KingLeonidas301 @novel_covid_19 I agree with you, I think the truth has been suppressed in many countries #COVID19 #wuhan #coronavirus",BoazDorset,"['COVID19', 'wuhan', 'coronavirus']",47
2020-02-22 20:23:58,Current status of cases of #Covid_19 #coronavirus around the world. In many cases no ones really sure how it ended up there. #Wuhan #China #DiamondPrincess https://t.co/Tg0GkXjxFy,BKsCorner,"['Covid_19', 'coronavirus', 'Wuhan', 'China', 'DiamondPrincess']",143
2020-02-22 20:23:15,#Coronavirus PANDEMIC  #China #France #Japan #wuhan #SouthKorea #Singapore #Thailand #Australia #breaking #breakingnews #HongKongProtests #Macau #Malaysia #Canada #SriLanka #Germany #UAE #India #Philippines #Finland #UK   #Italy #Iran  #USA  #TrumpVisitIndia https://t.co/34OGgo6RJX,deadlyfodz,"['Coronavirus', 'China', 'France', 'Japan', 'wuhan', 'SouthKorea', 'Singapore', 'Thailand', 'Australia', 'breaking', 'breakingnews', 'HongKongProtests', 'Macau', 'Malaysia', 'Canada', 'SriLanka', 'Germany', 'UAE', 'India', 'Philippines', 'Finland', 'UK', 'Italy', 'Iran', 'USA', 'TrumpVisitIndia']",126
2020-02-22 20:22:20,💪 from #spain 🇪🇸 too  @Havenlust  #coronavirus #Wuhan #COVID #COVID19 https://t.co/8TpgrV3xfs,QueridasFashion,"['spain', 'coronavirus', 'Wuhan', 'COVID', 'COVID19']",8093
2020-02-22 20:20:56,Coronavirus cases in South Korea up to 433 overnight - ABC News #coronavirus #CoronavirusSouthKorea #coronavirususa #CoronaVirusCanada #coronaviruswuhan #Wuhan #WuhanCoronavius #WuhanLockdown #WuhanOutbreak #coronavirusuk #CoronaVirusUpdate  https://t.co/mxDrfKZqZJ,Kirby_Cash,"['coronavirus', 'CoronavirusSouthKorea', 'coronavirususa', 'CoronaVirusCanada', 'coronaviruswuhan', 'Wuhan', 'WuhanCoronavius', 'WuhanLockdown', 'WuhanOutbreak', 'coronavirusuk', 'CoronaVirusUpdate']",1576
2020-02-22 20:20:51,Well wishes ❤️ From kind @justinbieber. He showed his solidarity &amp; support to #wuhan #china.   #music #artists #justinbieber #celebrity #wuhanjiayou #chinajiayou #tiktok #coronavirus https://t.co/GSLibrpF2d,ArtNBook,"['wuhan', 'china', 'music', 'artists', 'justinbieber', 'celebrity', 'wuhanjiayou', 'chinajiayou', 'tiktok', 'coronavirus']",122
2020-02-22 20:16:54,Maybe a #BioWeaponsLab all alone then. #CoronavirusOutbreak #coronavirus #CoronaOutbreak #China #WuhanCoronavirus #Wuhan https://t.co/pKAZ9DpPjD,Duktiamat,"['BioWeaponsLab', 'CoronavirusOutbreak', 'coronavirus', 'CoronaOutbreak', 'China', 'WuhanCoronavirus', 'Wuhan']",562
2020-02-22 20:14:01,"Researchers at the Chinese Academy of Sciences proved that the Seafood Market in #Wuhan is not the  #coronavirus originated place, and the virus genome has not undergone recombination. Two clusters expansions occurred on 8th/12 and 6th/1 @CDCgov Paper https://t.co/yYwxN7ndr6 https://t.co/Z0Qw5dw3wf",data_amazing,"['Wuhan', 'coronavirus']",4
2020-02-22 20:13:45,A video featuring a pregnant nurse treating patients in a hospital in the virus epicentre of #Wuhan has sparked a backlash across #China. #coronavirus https://t.co/M41i9lKwPX,IoanaGomoi,"['Wuhan', 'China', 'coronavirus']",15092
2020-02-22 20:11:28,#Coronavirus outbreak edges closer to #pandemic may soon be impossible to contain cases surge with no clear link to #China  https://t.co/B70ll3zaq9  #alerts #travel #health #CoronavirusOutbreak #WuhanCoronavirusOutbreak  #Wuhan #2019nCoV #COVID19,GovOneStop,"['Coronavirus', 'pandemic', 'China', 'alerts', 'travel', 'health', 'CoronavirusOutbreak', 'WuhanCoronavirusOutbreak', 'Wuhan', '2019nCoV', 'COVID19']",275
2020-02-22 20:08:08,"🔥😬FYI: Chinese govt originally said the necessary incubation period was 14 days: New info alleges the carrier can spread the disease up to 42+ days. Everything is ""GUESSTIMATION"" at this point because China is suppressing data &amp; info is evolving. #Coronavirus #Wuhan https://t.co/9dmjpScKJu",vallidawnhart,"['Coronavirus', 'Wuhan']",1698
2020-02-22 20:06:43,#Wuhan corona virus emerging - continues all over the world #COVID19 tens of thousands of flights were canceled due to the Chinese airspace. This must be the clearest evidence of how a virus isolates a nation.  #coronavirus #AvGeek https://t.co/DoqVarGH3k,DenizEngelhardt,"['Wuhan', 'COVID19', 'coronavirus', 'AvGeek']",1191
2020-02-22 20:05:00,Video: Life inside Wuhan: Residents talk about everyday life inside city at the center of the coronavirus https://t.co/i9OoFKnMyA #coronavirus  @northeastern   @NU_CAMD    @gobserver_nu   @3toread  #Wuhan #WuhanCoronavirus  @angelatys19 .,MattCData,"['coronavirus', 'Wuhan', 'WuhanCoronavirus']",6660
2020-02-22 20:03:30,"A view from one of the the hospitals in Wuhan, China. Retweet to share with others #china #Coronavius #wuhan #corona #death #CoronavirusOutbreak #coronavirus https://t.co/lxNZM6mIAt",healthvirusnews,"['china', 'Coronavius', 'wuhan', 'corona', 'death', 'CoronavirusOutbreak', 'coronavirus']",11
2020-02-22 20:02:56,Inconvenient coincidence: #Wuhan Provence is the only place with a BioSafety Level 4 Lab that works with the world’s deadliest pathogens. But we aren’t talking about that - we’re talking about bat soup. #coronavirus,capiman,"['Wuhan', 'coronavirus']",125
2020-02-22 20:00:12,"Pandemic Protection Kit Complete - with Half-Face CBRN Respirator, Boots, Kleenguard Suit https://t.co/rzRLwpJL9t  #ad #coronavirus #coronaoutbreak #flu #corona #virus #CoronavirusOutbreak #coronaviruswuhan #2019nCoV #COVID19 #wuhan #china #outbreak #CoronavirusUSA #pandemic",mystylehfb,"['ad', 'coronavirus', 'coronaoutbreak', 'flu', 'corona', 'virus', 'CoronavirusOutbreak', 'coronaviruswuhan', '2019nCoV', 'COVID19', 'wuhan', 'china', 'outbreak', 'CoronavirusUSA', 'pandemic']",5698
2020-02-22 19:59:16,"#coronavirus #covid19 #CCP #China2025 #China2049 #wuhan #sars #wuhancoronavirus #pathogens  ""Meanwhile, the fact that so few other companies have followed Apple’s lead highlights one of the biggest challenges facing corporations today: telling the truth."" https://t.co/4tLnVjzIvl",tibor_junhe,"['coronavirus', 'covid19', 'CCP', 'China2025', 'China2049', 'wuhan', 'sars', 'wuhancoronavirus', 'pathogens']",272
2020-02-22 19:56:00,"This video deserves the appropriate hashtags, so…  #WuFlu #Wuhan #coronavirus #COVID19 #2019nCoV #pneumonia https://t.co/KgrHSdw8Ho",Miztiki,"['WuFlu', 'Wuhan', 'coronavirus', 'COVID19', '2019nCoV', 'pneumonia']",377
2020-02-22 19:50:36,Coronavirus politicized in Lebanon as some blame Iran.. #Wuhan #Coronavirus #Canada AgNP Biotics &gt; https://t.co/Bmyy7EG5q2 &lt; https://t.co/CveRIA6eOz,AGNCanada,"['Wuhan', 'Coronavirus', 'Canada']",1126
2020-02-22 19:45:42,"Not a virologist, but cld it be possible that #China's strict quarantine measures led to mutations that prolong the incubation period. Strains with shorter periods die out, only those with longer periods still can find new hosts.  #Wuhan #Hubei #SouthKorea #Coronavirus #Italy",TrumpCritic,"['China', 'Wuhan', 'Hubei', 'SouthKorea', 'Coronavirus', 'Italy']",1231
2020-02-22 19:44:35,@Quamasparagi @DrDavidACox Did check #Skyscanner yesterday and it appears even flights from #Wuhan to #London still available albeit via #Shanghai #Beijing. Does give a caveat referencing #coronavirus affecting some flight destinations. So not sure. 👀🦠👀,CumminsLover,"['Skyscanner', 'Wuhan', 'London', 'Shanghai', 'Beijing', 'coronavirus']",24
2020-02-22 19:40:45,Look at the face of a Pakistani mother who’s daughter stuck in Wuhan and then look at the reaction of Zafar Mirza! Allah ki lathi be awaz hai. @zfrmrza @SenRehmanMalik #coronavirus #COVID #COVID19italia #Wuhan #WuhanCoronavirus  #AllahIsSuperPower #Coronavirustruth https://t.co/PsR2T9ydTK,ImHussnainSethi,"['coronavirus', 'COVID', 'COVID19italia', 'Wuhan', 'WuhanCoronavirus', 'AllahIsSuperPower', 'Coronavirustruth']",221
2020-02-22 19:35:22,"@IndoPac_Info #SouthKorea #coronavirus #COVID #Wuhan Please share &amp; help tell people to boost their immune system. I've been a nurse for 30 years, people can help strengthen their own immune system. Zinc, honey, and fruits all work to kill viruses. Baking soda helps alkalinize your body. https://t.co/kyxCq1PSMa",CarolinaFaith2,"['SouthKorea', 'coronavirus', 'COVID', 'Wuhan']",20
2020-02-22 19:34:31,@POTUS @realDonaldTrump Please extend the #coronavirus #Covid_19  #quarantine to AT LEAST an additional 7 days of self isolation.  #Wuhan... #China... #SouthKorea... #Iran...  Act Now!!! #CloseTheBorders,BuenosNewChess,"['coronavirus', 'Covid_19', 'quarantine', 'Wuhan', 'China', 'SouthKorea', 'Iran', 'CloseTheBorders']",60
2020-02-22 19:34:22,"#Wuhan the place of #COVD19 #coronavirus, #God the peace inside. Welcome @WHO @CDCgov @DrTedros to #武汉 https://t.co/OajZtKfbOS",data_amazing,"['Wuhan', 'COVD19', 'coronavirus', 'God', '武汉']",4
2020-02-22 19:34:10,The #coronavirus message from #wuhan - no need for irrational panic!  https://t.co/zoobRiX6g1,cathynewman,"['coronavirus', 'wuhan']",188220
2020-02-22 19:30:13,"Now watching #INFERNO with Tom Hanks, where a crazy super-villain tries to wipe out humanity using a super-virus.  Good thing these things only happen in movies!  #CoronaVirus #COVID19 #China #Wuhan",Lars9596,"['INFERNO', 'CoronaVirus', 'COVID19', 'China', 'Wuhan']",45205
2020-02-22 19:30:07,"3M Full Facepiece Respirator 6900, Dust, Mold, Chemicals, Large https://t.co/N5tkdwGctd    #ad #coronavirus #coronaoutbreak #flu #corona #virus #CoronavirusOutbreak #coronaviruswuhan #2019nCoV #COVID19 #wuhan #china #outbreak #CoronavirusUSA #pandemic",mystylehfb,"['ad', 'coronavirus', 'coronaoutbreak', 'flu', 'corona', 'virus', 'CoronavirusOutbreak', 'coronaviruswuhan', '2019nCoV', 'COVID19', 'wuhan', 'china', 'outbreak', 'CoronavirusUSA', 'pandemic']",5698
2020-02-22 19:30:00,"Coronavirus could be detected even before symptoms start, New England Journal of Medicine report claims.. || #Coronavirus #Wuhan #China #England #COVID #CoronavirusOutbreak  #COVID19 https://t.co/OM070ynW3d",TPE_connect,"['Coronavirus', 'Wuhan', 'China', 'England', 'COVID', 'CoronavirusOutbreak', 'COVID19']",632
2020-02-22 19:30:00,"Another case of the sudden collapse at the shopping mall in Hong Kong, possibly due to #coronavirus #COVID #COVID19 #China #wuhan #冠状病毒 #coronavirus #CoronavirusOutbreak #Wuhan #coronaviruschina #coronavirusaustralia #CoronaVirusCanada",RoutVanna,"['coronavirus', 'COVID', 'COVID19', 'China', 'wuhan', '冠状病毒', 'coronavirus', 'CoronavirusOutbreak', 'Wuhan', 'coronaviruschina', 'coronavirusaustralia', 'CoronaVirusCanada']",479
2020-02-22 19:29:30,"CDC working up contingency plans to shutter schools, major businesses in likely event of US pandemic of #Wuhan #coronavirus #COVID https://t.co/Lp7ybJuGEb",SkipMarcucciMD,"['Wuhan', 'coronavirus', 'COVID']",3038
2020-02-22 19:28:52,"A Royal Screw Up From The Nations, Including The Americans To Pick Up The Sick From #Wuhan #China #coronavirus #COVID19 @CDCgov",BostonRoca,"['Wuhan', 'China', 'coronavirus', 'COVID19']",1217
2020-02-22 19:27:46,a funny Chinese policeman in #Wuhan 😺😹  #coronavirus #COVID19 https://t.co/eDFKnOiapc,MarinaIwanovsky,"['Wuhan', 'coronavirus', 'COVID19']",2051
2020-02-22 19:23:33,#coronavirus #Coronavirustruth #CoronavirusCoverup #coronavirusuk #WuhanCoronavirus I say this because you are being fed managed other country big virus news to stop you thinking about why #Wuhan is not getting back to normal now!!!!!! GULP!! https://t.co/YDX3YHDLMM,Philj77,"['coronavirus', 'Coronavirustruth', 'CoronavirusCoverup', 'coronavirusuk', 'WuhanCoronavirus', 'Wuhan']",67
2020-02-22 19:23:16,“#China unleashed a plague on its own people.” #COVID19 #coronavirus #wuhan #italy #iran #SouthKorea The @CDCgov @WHO needs to admit it. #MAGA https://t.co/v2Ov27UYVl,dana_marlane,"['China', 'COVID19', 'coronavirus', 'wuhan', 'italy', 'iran', 'SouthKorea', 'MAGA']",302
2020-02-22 19:22:15,Nothing biblical happening in the world. Nope. 🙈  #SARSCoV2 #cdclies #covid19 #covid_19 #TerminatorChinaVirus  #nCoV2020 #nCoV2019 #2019_nCov #2019nCoV   #coronavirusoutbreak  #coronavirus  #coronaviruschina  #Wuhan #WuhanPneumonia #China #WuhanSARS #ChinaCoronaVirus #pandemic https://t.co/EOZ00U8j5U,FredWilliams77,"['SARSCoV2', 'cdclies', 'covid19', 'covid_19', 'TerminatorChinaVirus', 'nCoV2020', 'nCoV2019', '2019_nCov', '2019nCoV', 'coronavirusoutbreak', 'coronavirus', 'coronaviruschina', 'Wuhan', 'WuhanPneumonia', 'China', 'WuhanSARS', 'ChinaCoronaVirus', 'pandemic']",3990
2020-02-22 19:17:55,#Wuhan woman with no symptoms infects five relatives with #coronavirus - study https://t.co/mSxC7GFgck #CoronaVtj https://t.co/ENMGXKOivi,techjunkiejh,"['Wuhan', 'coronavirus', 'CoronaVtj']",28990
