timestamp,tweet_text,username,all_hashtags,followers_count
2020-02-22 19:51:09,"Because of ignorance and misinformation about the #Chinese #coronavirus,people are increasingly resorting to #xenophobic &amp; #racist attacks on Americans or foreigners of Asian descent  In #NY,it is reported that a man attacked a woman who wore a mask and called her obscene words https://t.co/qZKjwOXIga",karlson_ben,"['Chinese', 'coronavirus', 'xenophobic', 'racist', 'NY']",1583
2020-02-22 12:22:44,Tip for Mr #Trump: Mr @realDonaldTrump must tell #CDC to test Genekam #coronavirus 2020 kits and use them for testing as they give highly specific results.  #CNN #fda #wuhan #Washington #selectusa #nih #cnbc #WHO #reuters #nasdaq #dow #ny #nytimes #abc #medcine #uno #ard #CDU https://t.co/gVBi0KYQ7N,genekam7,"['Trump', 'CDC', 'coronavirus', 'CNN', 'fda', 'wuhan', 'Washington', 'selectusa', 'nih', 'cnbc', 'WHO', 'reuters', 'nasdaq', 'dow', 'ny', 'nytimes', 'abc', 'medcine', 'uno', 'ard', 'CDU']",123
2020-02-22 06:18:08,"When US Hospitals And Military Publicly Brace For A Pandemic, You Should Pay Attention | Zero Hedge https://t.co/WsHkf9g1n6 #Stocks #Bonds #Investing #Investor #Market #Coronavirus #Toronto #NY #NYSE #TSX #Gold #BitCoin #Hedgefund #MadMoney #Oil  #Silver",TylerInNiagara,"['Stocks', 'Bonds', 'Investing', 'Investor', 'Market', 'Coronavirus', 'Toronto', 'NY', 'NYSE', 'TSX', 'Gold', 'BitCoin', 'Hedgefund', 'MadMoney', 'Oil', 'Silver']",385
2020-02-22 06:17:49,S.Korea Coronavirus Cases Go Exponential As New Infections Soar By 70%; 10 Towns In Northern Italy Put On Lockdown | Zero Hedge https://t.co/oLdaDic0X2 #Stocks #Bonds #Investing #Investor #Market #Coronavirus #Toronto #NY #NYSE #TSX #Gold #BitCoin #Hedgefund #MadMoney #Oil,TylerInNiagara,"['Stocks', 'Bonds', 'Investing', 'Investor', 'Market', 'Coronavirus', 'Toronto', 'NY', 'NYSE', 'TSX', 'Gold', 'BitCoin', 'Hedgefund', 'MadMoney', 'Oil']",385
2020-02-22 06:14:26,Coronavirus cases in US and Europe confirmed https://t.co/qfPdlyNSFv via @YouTube #Stocks #Bonds #Investing #Investor #Market #Coronavirus #Toronto #NY #NYSE #TSX #Gold #BitCoin #Hedgefund #MadMoney #Oil  #Silver,TylerInNiagara,"['Stocks', 'Bonds', 'Investing', 'Investor', 'Market', 'Coronavirus', 'Toronto', 'NY', 'NYSE', 'TSX', 'Gold', 'BitCoin', 'Hedgefund', 'MadMoney', 'Oil', 'Silver']",385
2020-02-22 04:47:04,In #NY's #Westchester County there are 26 people are being quarantined in their homes over #COVID19 #coronavirus concerns after returning from #China.   https://t.co/8mQmewjfPc via @ABC7NY,CEDRdigital,"['NY', 'Westchester', 'COVID19', 'coronavirus', 'China']",6766
2020-02-21 11:34:42,The State University at #Albany is investigating whether an off-campus #coronavirus-themed party violated the college's student code of conduct. https://t.co/SZBYzeAwnh | #AlbanyNY #AlbanyCounty #NY #NYS #UpstateNY #SUNY #SUNYAlbany | 😆😅🤧,jonestowne,"['Albany', 'coronavirus', 'AlbanyNY', 'AlbanyCounty', 'NY', 'NYS', 'UpstateNY', 'SUNY', 'SUNYAlbany']",8962
2020-02-20 17:54:27,Goldman: Imminent Market Correction Now Looks Much More Probable | Zero Hedge https://t.co/ovmUehbySi #Stocks #Bonds #Investing #Investor #Market #Coronavirus #Toronto #NY #NYSE #TSX #Gold #BitCoin #Hedgefund #MadMoney #Oil  #Silver,TylerInNiagara,"['Stocks', 'Bonds', 'Investing', 'Investor', 'Market', 'Coronavirus', 'Toronto', 'NY', 'NYSE', 'TSX', 'Gold', 'BitCoin', 'Hedgefund', 'MadMoney', 'Oil', 'Silver']",385
2020-02-20 17:52:57,China Injects A Record 5 Trillion Yuan In New Debt To Arrest Economic Crash | Zero Hedge https://t.co/PPysarwhhD #Stocks #Bonds #Investing #Investor #Market #Coronavirus #Toronto #NY #NYSE #TSX #Gold #BitCoin #Hedgefund #MadMoney #Oil  #Silver #Recession,TylerInNiagara,"['Stocks', 'Bonds', 'Investing', 'Investor', 'Market', 'Coronavirus', 'Toronto', 'NY', 'NYSE', 'TSX', 'Gold', 'BitCoin', 'Hedgefund', 'MadMoney', 'Oil', 'Silver', 'Recession']",385
2020-02-19 20:17:30,"Lets not forget the 88 in #MA sick, the dead #PA children, the 6000+ #CA and 1000+ #NY self quarantined.  Oh yeah, haven't we evacuated about 2000 people here? Whats their status?  Good thing its #justtheflu and not #coronavirus #wuflu #NCOV19 or #covid19 https://t.co/RKYQoday93",justsee2k,"['MA', 'PA', 'CA', 'NY', 'justtheflu', 'coronavirus', 'wuflu', 'NCOV19', 'covid19']",46
2020-02-19 16:17:10,"@HealthNYGov we need public awareness of #covid19 now when we have the window of opportunity to contain a widespread outbreak. Inform us how to practically and mentally prepare for #coronavirus, even with no symptoms that you can still infect others and what measures to take tostop spread #ny",Sooki101,"['covid19', 'coronavirus', 'ny']",77
2020-02-19 12:03:09,Supposedly there are cases of #coronavirus #COVID19 in #Buffalo #NY and we aren’t being told. https://t.co/wVBlXy078T,cloudonamountan,"['coronavirus', 'COVID19', 'Buffalo', 'NY']",183
2020-02-18 23:05:05,#NY 26 #Westchester residents in #coronavirus quarantine after recent visit to China https://t.co/Jp23HDbvIo,yonkersoem40,"['NY', 'Westchester', 'coronavirus']",3362
2020-02-18 21:29:38,"#CDC placed a gag order on all medical professionals to not release #coronavirus info. From what I've gathered, its spreading all over #WA #NY #FL #TX #CA  Sources include #reddit and civilian commentaries all over social media platforms  #JustTheFlu #wuflu #flu",justsee2k,"['CDC', 'coronavirus', 'WA', 'NY', 'FL', 'TX', 'CA', 'reddit', 'JustTheFlu', 'wuflu', 'flu']",46
2020-02-18 21:03:40,This guy is either a good actor  / liar or a truth teller. #Coronavirus #NY #NewYork   https://t.co/spilNz4Wdk,NewsAlternative,"['Coronavirus', 'NY', 'NewYork']",2005
2020-02-18 20:20:04,"@JeromeAdamsMD Thanks!! Can you tell me the name of one hospital in #NY that has begun on site testing for #COVID19? I’ve heard that people have been tested for the #coronavirus in NY, but tests are sent to #CDC and the sick people leave the hospital awaiting results. https://t.co/hR4Gj5qOp1",dorisberriz,"['NY', 'COVID19', 'coronavirus', 'CDC']",29
2020-02-18 20:12:58,GLOBAL EMERGENCY: WORSE THAN THE SPANISH FLU - 20 TIMES MORE DEADLY - Get Prepare Now ! #Trump2020 #MAGA #KAG ##Coronavirus #COVID19 #US #USA #CA #NY #PA #NJ #TX #AZ #CO #CT #VA #IA #IL #OH #MN #OR #WA https://t.co/WRpXvyILNo via @YouTube,alexxx1232013,"['Trump2020', 'MAGA', 'KAG', 'Coronavirus', 'COVID19', 'US', 'USA', 'CA', 'NY', 'PA', 'NJ', 'TX', 'AZ', 'CO', 'CT', 'VA', 'IA', 'IL', 'OH', 'MN', 'OR', 'WA']",379
2020-02-17 18:06:27,"@shelly728 @MarcellaGrid Glad we could help. Here's one last resource for you since you live in #NY state, in case you want to check a Dr's medical background or practice. #coronavirus #COVID19 #nCoV_2019 #nCoV2019 #COVID_19   https://t.co/aBCyWVYFvz",CEDRdigital,"['NY', 'coronavirus', 'COVID19', 'nCoV_2019', 'nCoV2019', 'COVID_19']",6766
2020-02-17 17:57:17,I trust the #CDC numbers as much as #China's - it's not like we have an effective test - most people test negative 3-4 times before testing positive for #Coronavirus #CoronaVirusUSA #COVID19 #COVID19 #CoronavirusOutbreak #CORONAVIRUSENFRANCE #SARSCoV2 #BuffaloBills #NY #Florida https://t.co/vEcBoRytji,Beaubier,"['CDC', 'China', 'Coronavirus', 'CoronaVirusUSA', 'COVID19', 'COVID19', 'CoronavirusOutbreak', 'CORONAVIRUSENFRANCE', 'SARSCoV2', 'BuffaloBills', 'NY', 'Florida']",1636
2020-02-17 16:58:23,I really wish if someone could confirm if it's true. That NY state have a gag order on medical workers  and police and if this is at federal level. If this is the case. US is no different than China on that matter. #coronavirus #COVID19 #ny #newyork #news https://t.co/zO9dxABcSb,elmundodejezus,"['coronavirus', 'COVID19', 'ny', 'newyork', 'news']",12
2020-02-17 15:11:59,Rumors are that this is happening in #ny. Humans are the most unteachable animals in the kingdom. #COVID19 and #coronavirus https://t.co/8O1fhOjeDX,Ginny_mcmey,"['ny', 'COVID19', 'coronavirus']",25
2020-02-17 13:43:40,"Worth a listen about #ny, #nyc and #COVD19, #coronavirus— guy says New York State isn’t releasing information on at least 6 confirmed cases and that those with virus are at large in community. Can’t verify. You will have to decide for yourself.   https://t.co/GzWGpAwXyV",Ginny_mcmey,"['ny', 'nyc', 'COVD19', 'coronavirus']",25
2020-02-17 06:09:18,@MarcellaGrid @shelly728 One last resource: for those who want to know if anyone being tested in #NewYork state for the #coronavirus #COVID19 just check the #NY Health Dept Website: 🔗https://t.co/4DY4dhx3Ed  #nCoV2019 #COVID_19 #NYC #NewYorkCity #Queens #Bronx #Brooklyn https://t.co/pbVOEEyyow,CEDRdigital,"['NewYork', 'coronavirus', 'COVID19', 'NY', 'nCoV2019', 'COVID_19', 'NYC', 'NewYorkCity', 'Queens', 'Bronx', 'Brooklyn']",6766
2020-02-17 05:56:06,"@MarcellaGrid @shelly728 Ah, sorry, what started this thread was a person who asked me about a #coronavirus outbreak in #Buffalo and then another person about an outbreak in #Monroe, #NY -fakes both. An outbreak anywhere in the US would be covered locally first as they're near the story, then nationally.",CEDRdigital,"['coronavirus', 'Buffalo', 'Monroe', 'NY']",6766
2020-02-17 04:43:52,Rough life. Being served breakfast with bacon. While millions in #Democrats destroyed #IL #CA + #NY are starving and homeless🤬  #Democrats are #Elitist self-centered schitts: + openly share it🤦‍♀️😂🤣😂🤣  Maybe he's ill w/ #Coronavirus infiltrated brain? #SuperSpreader ? @CDCgov https://t.co/Df5gZgAfiR,NaniEight,"['Democrats', 'IL', 'CA', 'NY', 'Democrats', 'Elitist', 'Coronavirus', 'SuperSpreader']",3869
2020-02-17 04:24:46,"@shelly728 I can see from your twitter feed that you have retweeted a number of altered and manufactured #coronavirus #COVID19 videos &amp; audios, including the false stories about #Buffalo &amp; #Monroe #NY. Would you like me to share some forensic resources so you can identify fakes in future?",CEDRdigital,"['coronavirus', 'COVID19', 'Buffalo', 'Monroe', 'NY']",6766
2020-02-17 03:35:23,"5a/9 Contrary to manufactured news created to cause fear, #NewYork State does not have any novel #coronavirus #COVID19 cases. Of the 25 people tested, ALL 25 have had negative results. #NYC/#NY state residents can check status at:  🔗https://t.co/jVPEIuvozy  #nCoV2019 #COVID_19 https://t.co/ARF6W8KCsv",CEDRdigital,"['NewYork', 'coronavirus', 'COVID19', 'NYC', 'NY', 'nCoV2019', 'COVID_19']",6766
2020-02-16 20:51:25,Allegations that CDC is covering up 6cases of #coronavirus in #ny state- [unverified] https://t.co/IdIwFP2jyP,kujo1017,"['coronavirus', 'ny']",32
2020-02-16 17:20:52,MUST LISTEN!! caller sounds credible and knowledgeable about a very specific situation in upstate #NY #coronavirus https://t.co/o6aQ4f7EqR,612Gravy,"['NY', 'coronavirus']",172
2020-02-16 13:44:20,"Half Of China's Banks At Risk Of Failure According to Stress Test's, Oil... https://t.co/GEwMtOLUox via @YouTube #Stocks #Bonds #Investing #Investor #Market #Coronavirus #Toronto #NY #NYSE #TSX #Gold #BitCoin #Hedgefund #MadMoney #Oil  #Silver #BankRun #Frexit",TylerInNiagara,"['Stocks', 'Bonds', 'Investing', 'Investor', 'Market', 'Coronavirus', 'Toronto', 'NY', 'NYSE', 'TSX', 'Gold', 'BitCoin', 'Hedgefund', 'MadMoney', 'Oil', 'Silver', 'BankRun', 'Frexit']",385
2020-02-16 07:38:21,Five Ways 3D Printing Will Impact The Global Supply Chain https://t.co/iRCvGivags #Stocks #Bonds #Investing #Investor #Market #Coronavirus #Toronto #NY #NYSE #TSX #Gold #BitCoin #Hedgefund #MadMoney #Oil  #Silver #3DPrinter,TylerInNiagara,"['Stocks', 'Bonds', 'Investing', 'Investor', 'Market', 'Coronavirus', 'Toronto', 'NY', 'NYSE', 'TSX', 'Gold', 'BitCoin', 'Hedgefund', 'MadMoney', 'Oil', 'Silver', '3DPrinter']",385
2020-02-16 06:52:10,‘Frexit’ in air as Macron’s neoliberalism angers French – Galloway https://t.co/e6ZUQVyiNz via @YouTube #Stocks #Bonds #Investing #Investor #Market #Coronavirus #Toronto #NY #NYSE #TSX #Gold #BitCoin #Hedgefund #MadMoney #Oil  #Silver,TylerInNiagara,"['Stocks', 'Bonds', 'Investing', 'Investor', 'Market', 'Coronavirus', 'Toronto', 'NY', 'NYSE', 'TSX', 'Gold', 'BitCoin', 'Hedgefund', 'MadMoney', 'Oil', 'Silver']",385
2020-02-16 06:29:50,"""Tankers, Tankers. Everywhere!"" - Virus Causes Historic' Traffic Jam' Across Asian Supply Lines | Zero Hedge https://t.co/0ZTaO66Kfn #Stocks #Bonds #Investing #Investor #Market #Coronavirus #Toronto #NY #NYSE #TSX #Gold #BitCoin #Hedgefund #MadMoney #Oil  #Silver",TylerInNiagara,"['Stocks', 'Bonds', 'Investing', 'Investor', 'Market', 'Coronavirus', 'Toronto', 'NY', 'NYSE', 'TSX', 'Gold', 'BitCoin', 'Hedgefund', 'MadMoney', 'Oil', 'Silver']",385
2020-02-16 06:29:06,Hubei Doctors Warn Of Even-Deadlier Coronavirus Reinfection Causing Sudden Heart Attacks | Zero Hedge https://t.co/gdhbcJeLyZ #Stocks #Bonds #Investing #Investor #Market #Coronavirus #Toronto #NY #NYSE #TSX #Gold #BitCoin #Hedgefund #MadMoney #Oil  #Silver,TylerInNiagara,"['Stocks', 'Bonds', 'Investing', 'Investor', 'Market', 'Coronavirus', 'Toronto', 'NY', 'NYSE', 'TSX', 'Gold', 'BitCoin', 'Hedgefund', 'MadMoney', 'Oil', 'Silver']",385
2020-02-14 22:14:07,"China Is Disintegrating: Steel Demand, Property Sales, Traffic All Approaching Zero | Zero Hedge https://t.co/6WiGS4MbGb #Stocks #Bonds #Investing #Investor #Market #Coronavirus #Toronto #NY #NYSE #TSX #Gold #BitCoin #Hedgefund #MadMoney #Oil  #Silver",TylerInNiagara,"['Stocks', 'Bonds', 'Investing', 'Investor', 'Market', 'Coronavirus', 'Toronto', 'NY', 'NYSE', 'TSX', 'Gold', 'BitCoin', 'Hedgefund', 'MadMoney', 'Oil', 'Silver']",385
2020-02-14 22:13:51,"Chinese Experts Warn Of Imminent ""Surge"" In Coronavirus Cases: Virus Updates | Zero Hedge https://t.co/7eY3jooLAk #Stocks #Bonds #Investing #Investor #Market #Coronavirus #Toronto #NY #NYSE #TSX #Gold #BitCoin #Hedgefund #MadMoney #Oil  #Silver",TylerInNiagara,"['Stocks', 'Bonds', 'Investing', 'Investor', 'Market', 'Coronavirus', 'Toronto', 'NY', 'NYSE', 'TSX', 'Gold', 'BitCoin', 'Hedgefund', 'MadMoney', 'Oil', 'Silver']",385
2020-02-14 14:27:04,"'It's Coming': CDC Director Warns Coronavirus To Become Widespread Throughout United States, | Zero Hedge https://t.co/HJXe9A6XPP #Stocks #Bonds #Investing #Investor #Market #Coronavirus #Toronto #NY #NYSE #TSX #Gold #BitCoin #Hedgefund #MadMoney #Oil  #Silver",TylerInNiagara,"['Stocks', 'Bonds', 'Investing', 'Investor', 'Market', 'Coronavirus', 'Toronto', 'NY', 'NYSE', 'TSX', 'Gold', 'BitCoin', 'Hedgefund', 'MadMoney', 'Oil', 'Silver']",385
2020-02-14 14:26:11,"US Says New Travel Restrictions ""On The Table"" As Singapore, Hong Kong Report Sharp Rise In New Cases | Zero Hedge https://t.co/7eY3jooLAk #Stocks #Bonds #Investing #Investor #Market #Coronavirus #Toronto #NY #NYSE #TSX #Gold #BitCoin #Hedgefund #WHO #MadMoney #Oil  #Silver",TylerInNiagara,"['Stocks', 'Bonds', 'Investing', 'Investor', 'Market', 'Coronavirus', 'Toronto', 'NY', 'NYSE', 'TSX', 'Gold', 'BitCoin', 'Hedgefund', 'WHO', 'MadMoney', 'Oil', 'Silver']",385
2020-02-14 11:28:13,Royal Caribbean Cancels 18 Cruises As Thousands Remain Trapped Aboard 'Diamond Princess' | Zero Hedge https://t.co/thniDHf4NX  #Stocks #Bonds #Investing #Investor #Market #Coronavirus #Toronto #NY #NYSE #TSX #Gold #BitCoin #Hedgefund #WHO #MadMoney #Oil  #Silver,TylerInNiagara,"['Stocks', 'Bonds', 'Investing', 'Investor', 'Market', 'Coronavirus', 'Toronto', 'NY', 'NYSE', 'TSX', 'Gold', 'BitCoin', 'Hedgefund', 'WHO', 'MadMoney', 'Oil', 'Silver']",385
2020-02-14 00:53:15,"@ScottGottliebMD I don't get it! Why do we start with it so late?? Here in #NY people should start worrying. AND Why don't they disinfect subway stations and trains, buses, airports already??? As a precaution!! #coronavirus WHAT are we waiting for???",minzi8mango,"['NY', 'coronavirus']",1059
2020-02-13 21:37:23,"Six in Monroe County under voluntary quarantine for #coronavirus  #ROCHESTER, #NY. (WKBW) https://t.co/OTrijmGQ8G",NewsAlternative,"['coronavirus', 'ROCHESTER', 'NY']",2005
2020-02-13 18:29:42,"China reports sharp spike in new virus cases, deaths  CNBC Television https://t.co/FGhgdeISIx via @YouTube #Stocks #Bonds #Investing #Investor #Market #Coronavirus #Toronto #NY #NYSE #TSX #Gold #BitCoin #Hedgefund #WHO #MadMoney #Oil #OilSands #Silver #Economy",TylerInNiagara,"['Stocks', 'Bonds', 'Investing', 'Investor', 'Market', 'Coronavirus', 'Toronto', 'NY', 'NYSE', 'TSX', 'Gold', 'BitCoin', 'Hedgefund', 'WHO', 'MadMoney', 'Oil', 'OilSands', 'Silver', 'Economy']",385
2020-02-13 16:55:04,Falling Oil Prices An Economic Warning Sign | Zero Hedge https://t.co/ZaC4bJjjSr #Stocks #Bonds #Investing #Investor #Market #Coronavirus #Toronto #NY #NYSE #TSX #Gold #BitCoin #Hedgefund #WHO #MadMoney #Oil #OilSands #Silver,TylerInNiagara,"['Stocks', 'Bonds', 'Investing', 'Investor', 'Market', 'Coronavirus', 'Toronto', 'NY', 'NYSE', 'TSX', 'Gold', 'BitCoin', 'Hedgefund', 'WHO', 'MadMoney', 'Oil', 'OilSands', 'Silver']",385
2020-02-13 16:20:58,A Humiliated Wall Street Scrambles To Convince Clients That Nothing Is F***ed Here As Infections Soar | Zero Hedge https://t.co/g1b1q2717a #Stocks #Bonds #Investing #Investor #Market #Coronavirus #Toronto #NY #NYSE #TSX #Gold #BitCoin #Hedgefund #WHO #MadMoney #Oil  #Silver,TylerInNiagara,"['Stocks', 'Bonds', 'Investing', 'Investor', 'Market', 'Coronavirus', 'Toronto', 'NY', 'NYSE', 'TSX', 'Gold', 'BitCoin', 'Hedgefund', 'WHO', 'MadMoney', 'Oil', 'Silver']",385
2020-02-13 16:18:07,"China Underreporting Virus Cases By Over 100,000 White House Claims, As 15th American Fall Sick | Zero Hedge https://t.co/bYI4TlCLaG #Stocks #Bonds #Investing #Investor #Market #Coronavirus #Toronto #NY #NYSE #TSX #Gold #BitCoin #Hedgefund #WHO #MadMoney #Oil #OilSands #Silver",TylerInNiagara,"['Stocks', 'Bonds', 'Investing', 'Investor', 'Market', 'Coronavirus', 'Toronto', 'NY', 'NYSE', 'TSX', 'Gold', 'BitCoin', 'Hedgefund', 'WHO', 'MadMoney', 'Oil', 'OilSands', 'Silver']",385
2020-02-13 02:03:32,"China Reports Huge Jump In New Coronavirus Infections And Deaths; Oil, Stocks Tumble | Zero Hedge https://t.co/8BOhxCZQLj #Stocks #Bonds #Investing #Investor #Market #Coronavirus #Toronto #NY #NYSE #TSX #Gold #BitCoin #Hedgefund #WHO #MadMoney #Oil #OilSands #Silver #Economy",TylerInNiagara,"['Stocks', 'Bonds', 'Investing', 'Investor', 'Market', 'Coronavirus', 'Toronto', 'NY', 'NYSE', 'TSX', 'Gold', 'BitCoin', 'Hedgefund', 'WHO', 'MadMoney', 'Oil', 'OilSands', 'Silver', 'Economy']",385
