timestamp,tweet_text,username,all_hashtags,followers_count
2020-02-23 17:12:27,Four new UK coronavirus cases among ship evacuees  #coronavirus #coronarvirues #CoronaOutbreak #Wuhan #China #COVID19   https://t.co/4tbnpmAhpL,yogendrapal72,"['coronavirus', 'coronarvirues', 'CoronaOutbreak', 'Wuhan', 'China', 'COVID19']",8844
2020-02-23 17:11:44,Disaster Relief Means Stealing During Disaster  #HRCratlines Cracks A Smile &amp; Part Of Her Face Breaks Off 😅+😉=👊  #COVID19 #Wetsuweten #cdnpoli #Coronavirus #China #Wuhan #FreeChina #XiJinping #Pandemic #BiologicalWarfare #Quarantine #MartialLaw #MilitaryTribunals #DeepState https://t.co/XrREUUEiq8,CLajambe,"['HRCratlines', 'COVID19', 'Wetsuweten', 'cdnpoli', 'Coronavirus', 'China', 'Wuhan', 'FreeChina', 'XiJinping', 'Pandemic', 'BiologicalWarfare', 'Quarantine', 'MartialLaw', 'MilitaryTribunals', 'DeepState']",133
2020-02-23 17:10:41,Quick question to #doctors.  Do you suspect #Covid19 #infection at first if you see a patient with a #cold #symptom now? #Coronavirus #fever #Wuhan #China #WHO,marietemporubat,"['doctors', 'Covid19', 'infection', 'cold', 'symptom', 'Coronavirus', 'fever', 'Wuhan', 'China', 'WHO']",7
2020-02-23 17:09:11,Another doctor has died treating #coronavirus patients in #Wuhan: that makes 5 doctors who’ve died in #China dealing with this crisis.,StephenMcDonell,"['coronavirus', 'Wuhan', 'China']",64010
2020-02-23 17:08:21,Northern Italy is shutting down due to #Wuhan #Coronavirus #COVID. Carnival in Venice is shutting down early also. https://t.co/vMLogFbXst,SkipMarcucciMD,"['Wuhan', 'Coronavirus', 'COVID']",3048
2020-02-23 17:08:10,"The Sounds of #Wuhan at Night During #COVID19 Outbreak  1/ Translation (from r/China_Flu)  ""-Well friends, yours truly, the guy online in this little neighborhood block can't hold it anymore. Let's hear this scream.  -No idea what they're waiting for"" #Coronavirus https://t.co/kmrVqSWoCH",JCovid19,"['Wuhan', 'COVID19', 'Coronavirus']",67
2020-02-23 17:05:51,A must read in today’s @nypost #NYPost article by #stevenmosher makes complete sense &amp; is horrifying. Until reading this I had no idea #China had a bio lab in #Wuhan   #coronavirus #COrVID19 #coronavirusitalla THE WORLD MUST STEP IN  Why China immediately built hospitals in days https://t.co/iCorCz4efO,2L8ICU,"['NYPost', 'stevenmosher', 'China', 'Wuhan', 'coronavirus', 'COrVID19', 'coronavirusitalla']",3
2020-02-23 17:00:14,Medical workers in #Wuhan have raced against time and spared no effort to fight against the epidemic. #COVID19 #coronavirus https://t.co/HVIrO4MPRI,ChinaDaily,"['Wuhan', 'COVID19', 'coronavirus']",4288133
2020-02-23 17:00:05,"New Research: Bats Harbor Hundreds Of Coronaviruses, And Spillovers Aren't Rare https://t.co/iFomcDmF3P #coronavirus #2019nCoV #virus #chinavirus #wuhan #sos #COVID19",misskatiele,"['coronavirus', '2019nCoV', 'virus', 'chinavirus', 'wuhan', 'sos', 'COVID19']",69
2020-02-23 17:00:01,"Roads are voluntarily opened to make way for the migration back to work, the people are eager to get back to work and enjoy a affluent lifestyle with relative freedom #coronavirus #CoronavirusOutbreak #Wuhan #coronaviruschina #coronavirusaustralia #CoronaVirusCanada",PrimitiveTube,"['coronavirus', 'CoronavirusOutbreak', 'Wuhan', 'coronaviruschina', 'coronavirusaustralia', 'CoronaVirusCanada']",128
2020-02-23 17:00:00,Are they patients ? 😢 #coronavirus #corona #COVID19  #WuhanCoronavirus #COVID #COVID19 #China #wuhan #冠状病毒 #coronavirus #CoronavirusOutbreak #Wuhan #coronaviruschina #coronavirusaustralia #CoronaVirusCanada,RoutVanna,"['coronavirus', 'corona', 'COVID19', 'WuhanCoronavirus', 'COVID', 'COVID19', 'China', 'wuhan', '冠状病毒', 'coronavirus', 'CoronavirusOutbreak', 'Wuhan', 'coronaviruschina', 'coronavirusaustralia', 'CoronaVirusCanada']",495
2020-02-23 17:00:00,"And over a hundred joined a rally at #LeiChengUkEstate, #CheungShaWan yesterday, residents also angry about #HongKong govt assign designated outpatient clinic for #Coronavirus patients in residential area. #COVID #COVID19 #China #wuhan #冠状病毒",Esmerda9,"['LeiChengUkEstate', 'CheungShaWan', 'HongKong', 'Coronavirus', 'COVID', 'COVID19', 'China', 'wuhan', '冠状病毒']",1128
2020-02-23 17:00:00,"A family cannot return home after Chinese New Year holiday.  #Coronavirus #Wuhan  #武汉肺炎 #新冠病毒 #COVID19 #ChinaVirus #Chinese Crying face Location: rural area of Heze, Shandong Province #COVID #COVID19 #China #wuhan #冠状病毒 #coronavirus #CoronavirusOutbreak #Wuhan",zhuannit,"['Coronavirus', 'Wuhan', '武汉肺炎', '新冠病毒', 'COVID19', 'ChinaVirus', 'Chinese', 'COVID', 'COVID19', 'China', 'wuhan', '冠状病毒', 'coronavirus', 'CoronavirusOutbreak', 'Wuhan']",623
2020-02-23 16:59:29,"China has approved first antiviral drug Favilavir to be used to treat corona (Covid 19) infections. Two other drugs, Chloroquine as well as remdisivir are still under assessment. #coronavirus #wuhan https://t.co/E719fQlUZZ",AfricaInNetwork,"['coronavirus', 'wuhan']",62
2020-02-23 16:58:47,URGENT: #Coronavirus: #Wuhan to quarantine all cured patients for 14 days after some test positive AGAIN. Chinese authorities say that patients MAY CARRY THE VIRUS EVEN AFTER RECOVERY,ASBreakingNews,"['Coronavirus', 'Wuhan']",6889
2020-02-23 16:58:08,"325 in Michigan that visited China or that were on an unidentified cruise ship with confirmed COVID19 cases, are self-quarantined because they’re not “high risk” according to Michigan Health Dpt. #Coronavirus #Wuhan   https://t.co/eYKRG38kzl",skylark1984,"['Coronavirus', 'Wuhan']",1652
2020-02-23 16:56:32,Coronavirus: How WHO Corruption Helped It Spread https://t.co/Bi3RRbRRHW via @YouTube   #WHO #Coronavirus #Wuhan Coronavirus,tinating2016,"['WHO', 'Coronavirus', 'Wuhan']",1
2020-02-23 16:54:49,10 Cities Shut Down In Italy That was Yesterday  New Report About To Watch  #COVID19  #PeterNygard #Avenatti #Wetsuweten #onpoli #cdnpoli #Coronavirus #China #Wuhan #FreeChina #XiJinping #Pandemic #BiologicalWarfare #Quarantine #MartialLaw #MilitaryTribunals #DeepState https://t.co/oVqZKq1k1O,CLajambe,"['COVID19', 'PeterNygard', 'Avenatti', 'Wetsuweten', 'onpoli', 'cdnpoli', 'Coronavirus', 'China', 'Wuhan', 'FreeChina', 'XiJinping', 'Pandemic', 'BiologicalWarfare', 'Quarantine', 'MartialLaw', 'MilitaryTribunals', 'DeepState']",133
2020-02-23 16:50:00,"Now, listen....very, very, carefully..""either naturally caused OR INTENTIONALLY CAUSED."" #COVID #COVID19 #China #wuhan #冠状病毒 #coronavirus #CoronavirusOutbreak #Wuhan #coronaviruschina #coronavirusaustralia",Esmerda9,"['COVID', 'COVID19', 'China', 'wuhan', '冠状病毒', 'coronavirus', 'CoronavirusOutbreak', 'Wuhan', 'coronaviruschina', 'coronavirusaustralia']",1128
2020-02-23 16:48:03,Coronavirus: Towns in lockdown as Italy races to contain Europe’s biggest outbreak #nCoV2019 #COVID19 #coronavirus #Italy #Veneto #Lombardy #Codogno #wuhan #china #emergency #epidemic #quarantine https://t.co/C2IBne7kFt https://t.co/iae9iVGNVo,yamkin1,"['nCoV2019', 'COVID19', 'coronavirus', 'Italy', 'Veneto', 'Lombardy', 'Codogno', 'wuhan', 'china', 'emergency', 'epidemic', 'quarantine']",1973
2020-02-23 16:46:55,"jaye - DEJAVU   A romantic ballad buoyed by string movements, “DEJA VU” picks up where jaye’s debut left off.  https://t.co/HXBBG9LQFZ  #jaye #DEJVAU #Singapore #Pop #jpop #twentyonepilots #gorillaz #wuhan #coronavirus",SeanCar79447369,"['jaye', 'DEJVAU', 'Singapore', 'Pop', 'jpop', 'twentyonepilots', 'gorillaz', 'wuhan', 'coronavirus']",315
2020-02-23 16:45:36,The #Chinese Communist Party is the super virus destroying humanity.  #CCP #China #Coronavirus #Wuhan https://t.co/QUtPz1I0Po,AbdugheniSabit,"['Chinese', 'CCP', 'China', 'Coronavirus', 'Wuhan']",14203
2020-02-23 16:45:00,"“During the coronavirus outbreak, no one is allowed to play poker or Mahjong.” 4 people who played Mahjong together were forced to parade on the street carrying the tablet amid the #CoronavirusOutbreak. #COVID #COVID19 #China #wuhan #冠状病毒 #coronavirus #CoronavirusOutbreak",zhuannit,"['CoronavirusOutbreak', 'COVID', 'COVID19', 'China', 'wuhan', '冠状病毒', 'coronavirus', 'CoronavirusOutbreak']",623
2020-02-23 16:43:07,"#CoronavirusOutbreak #China #covid19 #coronavirus #wuhan #hubei  #canada #montreal #quebec #toronto  Because canadians want truth ,  I think we all agree thats phase 6 is completed ...  Coronavirus is pandemic . https://t.co/CW5rYLPATI",opinionsanonym,"['CoronavirusOutbreak', 'China', 'covid19', 'coronavirus', 'wuhan', 'hubei', 'canada', 'montreal', 'quebec', 'toronto']",131
2020-02-23 16:42:13,"@howroute Speaking of patient zero, we STILL don't have relevant info on the earliest #wuhan human (and animal) #coronavirus victims, altho today it came out that it didn't start at the wet market after all https://t.co/iwgQsY5xyd https://t.co/1EuxEnNf3S",WhiteBlabbit,"['wuhan', 'coronavirus']",37
2020-02-23 16:40:09,"CGTN @CGTNOfficial · 1h Touching Moment: A veteran with the novel #coronavirus stretches out his trembling hand to salute the medical staff in Huoshenshan Hospital in #Wuhan.   He used to guard the country with his life, now it's our turn to guard him.",OpenTechPark,"['coronavirus', 'Wuhan']",59
2020-02-23 16:38:54,Before it was blamed on @realDonaldTrump Were american lives risked just for a political show&amp;to take trump down for elections? Should be treason for who did this and the news stations who grabbed this and reported falsely! #Trump2020 #wuhan #coronavirus   https://t.co/UufsWlJ996,VeritasDolor,"['Trump2020', 'wuhan', 'coronavirus']",3969
2020-02-23 16:37:17,Fake news o inconscients?   #wuhan #coronavirus #covid19 #coronavirusoutbreak #coronavirusflu https://t.co/SWwHlCeM2X,XaviMitjavila,"['wuhan', 'coronavirus', 'covid19', 'coronavirusoutbreak', 'coronavirusflu']",54
2020-02-23 16:35:36,@stu122208 @onlyyoontv lololz now that the MSM is jumping on the lab 🧪 created escape theory Xi and friends are trying to cook up an even crazier BS story  #FreeZeroHedge #china #wuhan #coronavirus #CoronavirusOutbreak #Corona #investing #investment #asia,QContrarian,"['FreeZeroHedge', 'china', 'wuhan', 'coronavirus', 'CoronavirusOutbreak', 'Corona', 'investing', 'investment', 'asia']",712
2020-02-23 16:35:25,BREAKING: Four more #people taken to #England test positive for #coronavirus https://t.co/G6Rkpap2E7 via @MailOnline #SARS #AIDS #epidemics #UK #Wuhan #China #NWO #evil https://t.co/bAOOQxk4zE,butlincat,"['people', 'England', 'coronavirus', 'SARS', 'AIDS', 'epidemics', 'UK', 'Wuhan', 'China', 'NWO', 'evil']",823
2020-02-23 16:33:55,loloz👇👇 #china straight up trying to say #coronavirus originated in the US or outside China...  twisted part is that WHO is going to eat up this narrative and spoon feed it to you at the behest of Xi... and @twitter will punish you for saying otherwise  #asia #Wuhan #investment https://t.co/cYdJNLNbie,QContrarian,"['china', 'coronavirus', 'asia', 'Wuhan', 'investment']",712
2020-02-23 16:31:30,"A history of #Wuhan, one-time #Chinese capital and #coronavirus epicenter - CNN https://t.co/fSyTZpaJLJ",AfrakanEmporium,"['Wuhan', 'Chinese', 'coronavirus']",1194
2020-02-23 16:30:54,No schedule to Open in Chengdu and Chongqing Yet………@HKVAGalleries   #coronavirus #2019_nCov #art #Wuhan #gallery #VAGalleries #Chengdu #Chongqing https://t.co/BNzgGl5CKw,Vincent_DENG,"['coronavirus', '2019_nCov', 'art', 'Wuhan', 'gallery', 'VAGalleries', 'Chengdu', 'Chongqing']",364
2020-02-23 16:30:14,Briutcare Antibacterial Wipes 400 Alcohol Prep Pad Extra Large Hand Sanitizer Travel Size https://t.co/DXqsXptqfD  #ad #coronavirus #coronaoutbreak #flu #corona #virus #CoronavirusOutbreak #coronaviruswuhan #2019nCoV #COVID19 #wuhan #china #outbreak #CoronavirusUSA #pandemic,mystylehfb,"['ad', 'coronavirus', 'coronaoutbreak', 'flu', 'corona', 'virus', 'CoronavirusOutbreak', 'coronaviruswuhan', '2019nCoV', 'COVID19', 'wuhan', 'china', 'outbreak', 'CoronavirusUSA', 'pandemic']",5701
2020-02-23 16:30:00,German study lists 20 countries that are most likely to import coronavirus around the world.. #Germany #Coronavirus #COVID #Wuhan #WuhanCoronavirus #CoronavirusOutbreak #China #CoronavirusChina #COVID19 https://t.co/IpEqhHByAH,TPE_connect,"['Germany', 'Coronavirus', 'COVID', 'Wuhan', 'WuhanCoronavirus', 'CoronavirusOutbreak', 'China', 'CoronavirusChina', 'COVID19']",629
2020-02-23 16:30:00,"The Communist Party of China will beat you and put you in jail if you don’t wear face mask in public, part 2 #coronavirusOutbreak #COVID19 #SARSCoV2 #WuhanCoronavirus #2019nCoV #coronavirus #wuhan",Esmerda9,"['coronavirusOutbreak', 'COVID19', 'SARSCoV2', 'WuhanCoronavirus', '2019nCoV', 'coronavirus', 'wuhan']",1128
2020-02-23 16:29:57,China still has a ways to go before finally curbing and defeating this fatal virus once and for all. We hope China would soon succeed in winning a decisive victory against this deadly virus  #china #coronavirus #wuhan #wuhanoutbreak #Covid_19 #COVID https://t.co/oUXTTCV1rV,KashifMirzaAM,"['china', 'coronavirus', 'wuhan', 'wuhanoutbreak', 'Covid_19', 'COVID']",64
2020-02-23 16:26:38,#CoronaVirusitaly #coronavirus #coronavirusaustralia  #China #wuhan #CoronavirusOutbreak #coronavirusitalIa  #coronavirususa   The Virus is starting to spread in Europe 😷 #Italia https://t.co/nsJ3dLBXRI,QuixoticGoals,"['CoronaVirusitaly', 'coronavirus', 'coronavirusaustralia', 'China', 'wuhan', 'CoronavirusOutbreak', 'coronavirusitalIa', 'coronavirususa', 'Italia']",1947
2020-02-23 16:25:38,“Aiyah Aiyah! My arms are going to break!” Chinese #Police take away an elderly man for not wearing a #FaceMask in #Beijing amid the #CoronavirusOutbreak. #COVID #COVID19 #China #wuhan #冠状病毒 #coronavirus #CoronavirusOutbreak #Wuhan #coronaviruschina #coronavirusaustralia,zhuannit,"['Police', 'FaceMask', 'Beijing', 'CoronavirusOutbreak', 'COVID', 'COVID19', 'China', 'wuhan', '冠状病毒', 'coronavirus', 'CoronavirusOutbreak', 'Wuhan', 'coronaviruschina', 'coronavirusaustralia']",623
2020-02-23 16:22:46,Maybe we should've closed our borders when we first found out about the #UScoronavirus #Covid #COVID19 #SarsCoV2 #2019nCoV #NCIP #NECIP #WuhanCoronavirusOutbreak #Wuhan #wuhanvirus #WuhanOutbreak #coronavirus #CoronavirusOutbreak #ChinaCoronaVirus #Italycoronavirus #UnitedStates https://t.co/DcGxuaN378,twotinydoggies,"['UScoronavirus', 'Covid', 'COVID19', 'SarsCoV2', '2019nCoV', 'NCIP', 'NECIP', 'WuhanCoronavirusOutbreak', 'Wuhan', 'wuhanvirus', 'WuhanOutbreak', 'coronavirus', 'CoronavirusOutbreak', 'ChinaCoronaVirus', 'Italycoronavirus', 'UnitedStates']",1992
2020-02-23 16:21:59,"2-year old patient in E China’s Zhejiang Province bowed to a nurse to express gratitude for her care at hospital, and the nurse bowed in return.  #china #coronavirus #covid19 #COVID #wuhan #WuhanOutbreak https://t.co/Rac773tP6W",KashifMirzaAM,"['china', 'coronavirus', 'covid19', 'COVID', 'wuhan', 'WuhanOutbreak']",64
2020-02-23 16:21:57,@NorthmanTrader @carlquintanilla How did #Wuhan residents kill time when they were trapped at home during #coronavirus city #lockdown? Here’s a clue: they made the second largest number of “#stock account opening” searches on https://t.co/ShUeEQH9Tx https://t.co/jn9QQKgKYd https://t.co/Jn1qaopDT4,daal_peena,"['Wuhan', 'coronavirus', 'lockdown', 'stock']",5
2020-02-23 16:21:55,Xi Jinping Is Human Trash  Change My Mind&lt;~  #COVID19  #PeterNygard #Avenatti #Wetsuweten #onpoli #cdnpoli #Coronavirus #China #Wuhan #FreeChina #XiJinping #Pandemic #BiologicalWarfare #Quarantine #MartialLaw #MilitaryTribunals #DeepState https://t.co/RHyHZ4r80i,CLajambe,"['COVID19', 'PeterNygard', 'Avenatti', 'Wetsuweten', 'onpoli', 'cdnpoli', 'Coronavirus', 'China', 'Wuhan', 'FreeChina', 'XiJinping', 'Pandemic', 'BiologicalWarfare', 'Quarantine', 'MartialLaw', 'MilitaryTribunals', 'DeepState']",133
2020-02-23 16:20:00,"Last night, people from Qingshan District in #Wuhan taken to No. 2 Hospital of Wuhan Iron &amp; Steel Corp to be ""educated"" after being caught for walking on the street amid coronavirus outbreak. #COVID19 #Coronavirus #COVID #COVID19 #China #wuhan #冠状病毒 #coronavirus",Esmerda9,"['Wuhan', 'COVID19', 'Coronavirus', 'COVID', 'COVID19', 'China', 'wuhan', '冠状病毒', 'coronavirus']",1128
2020-02-23 16:18:10,@SkyNews These people should not have been bought back so quickly #Covid_19 #coronavirus #wuhan,BoazDorset,"['Covid_19', 'coronavirus', 'wuhan']",47
2020-02-23 16:17:30,"The Military World Games were held in #Wuhan in October. ""Perhaps the #US delegates brought the #coronavirus to Wuhan, and some mutation occurred to the virus, making it more deadly and contagious.",keesdellebeke,"['Wuhan', 'US', 'coronavirus']",410
2020-02-23 16:15:11,@CoronavirusUpd3 You know there is something very fishy when a paper is praise how China has handled the #CoronavirusOutbreak. #Wuhan #coronavirus #Hubei #Covid_19 #COVID19,bigapple_agent,"['CoronavirusOutbreak', 'Wuhan', 'coronavirus', 'Hubei', 'Covid_19', 'COVID19']",54
2020-02-23 16:13:36,"As #China cannot find the origin of #coronavirus outbreak, it's highly likely that America has opened a bag full of such viruses in #Wuhan to study its impact on Chinese.",walijon,"['China', 'coronavirus', 'Wuhan']",58
2020-02-23 16:12:14,Just A Guess So FO  Vaping Alcohol May Potentially Sterilize Throat?  Good News For Vapers &amp; Alcoholics  #Avenatti #Wetsuweten #onpoli #cdnpoli #Coronavirus #China #Wuhan #FreeChina #XiJinping #Pandemic #BiologicalWarfare #Quarantine #MartialLaw #MilitaryTribunals #DeepState,CLajambe,"['Avenatti', 'Wetsuweten', 'onpoli', 'cdnpoli', 'Coronavirus', 'China', 'Wuhan', 'FreeChina', 'XiJinping', 'Pandemic', 'BiologicalWarfare', 'Quarantine', 'MartialLaw', 'MilitaryTribunals', 'DeepState']",133
2020-02-23 16:11:09,WHO data so far...#coronavirus #wuhan #武汉加油 #世界加油 https://t.co/YFkhKAW90M,cinaforum,"['coronavirus', 'wuhan', '武汉加油', '世界加油']",1031
2020-02-23 16:10:44,"Some facts #Coronavirus: -Virus is originated in #Wuhan seafood market?-&gt;Not confirmed -Virus jumped frm bats 2 Pangolin?-&gt;Not confirmed -The data comes from China is accurate-&gt;No -The incubation time is 2 weeks-&gt;Not confirmed, longer -Contagious if no symptoms present-&gt;Confirmed",arzubarsk,"['Coronavirus', 'Wuhan']",1122
2020-02-23 16:10:39,Quarantine 30 days now. Virus 1 humans 0  #SARSCoV2 #cdclies #covid19 #covid_19 #TerminatorChinaVirus  #nCoV2020 #nCoV2019 #2019_nCov #2019nCoV   #coronavirusoutbreak  #coronavirus  #coronaviruschina  #Wuhan #WuhanPneumonia #China #WuhanSARS #ChinaCoronaVirus #pandemic https://t.co/WKdQ5hBVPb,FredWilliams77,"['SARSCoV2', 'cdclies', 'covid19', 'covid_19', 'TerminatorChinaVirus', 'nCoV2020', 'nCoV2019', '2019_nCov', '2019nCoV', 'coronavirusoutbreak', 'coronavirus', 'coronaviruschina', 'Wuhan', 'WuhanPneumonia', 'China', 'WuhanSARS', 'ChinaCoronaVirus', 'pandemic']",3991
2020-02-23 16:08:14,All The Animals In Wuhan Dying  Xi Jinping/UN &lt;~Crimes Against Humanity  UN Sold Out World To China  #Covid19 #Avenatti #Wetsuweten #onpoli #cdnpoli #Coronavirus #China #Wuhan #FreeChina #XiJinping #Pandemic #BiologicalWarfare #Quarantine #MartialLaw #MilitaryTribunals #DeepState https://t.co/PRGYEoQ6Jy,CLajambe,"['Covid19', 'Avenatti', 'Wetsuweten', 'onpoli', 'cdnpoli', 'Coronavirus', 'China', 'Wuhan', 'FreeChina', 'XiJinping', 'Pandemic', 'BiologicalWarfare', 'Quarantine', 'MartialLaw', 'MilitaryTribunals', 'DeepState']",133
2020-02-23 16:05:40,"This may happen in the #UnitedStates , please be prepared everyone. #Covid #COVID19 #SarsCoV2 #2019nCoV #NCIP #NECIP #WuhanCoronavirusOutbreak #Wuhan #wuhanvirus #WuhanOutbreak #coronavirus #CoronavirusOutbreak #ChinaCoronaVirus #DrFrancisBoyle #BioWeaponsExpert #USCoronaVirus https://t.co/U7zdGxAYHd",twotinydoggies,"['UnitedStates', 'Covid', 'COVID19', 'SarsCoV2', '2019nCoV', 'NCIP', 'NECIP', 'WuhanCoronavirusOutbreak', 'Wuhan', 'wuhanvirus', 'WuhanOutbreak', 'coronavirus', 'CoronavirusOutbreak', 'ChinaCoronaVirus', 'DrFrancisBoyle', 'BioWeaponsExpert', 'USCoronaVirus']",1992
2020-02-23 16:05:20,Not About Beating Virus Or Losing To It  About Survival Now  Virus Will Take Who It Wants &amp; Never Go Away  #COVID19  #Avenatti #Wetsuweten #cdnpoli #Coronavirus #China #Wuhan #FreeChina #XiJinping #Pandemic #BiologicalWarfare #Quarantine #MartialLaw #MilitaryTribunals #DeepState,CLajambe,"['COVID19', 'Avenatti', 'Wetsuweten', 'cdnpoli', 'Coronavirus', 'China', 'Wuhan', 'FreeChina', 'XiJinping', 'Pandemic', 'BiologicalWarfare', 'Quarantine', 'MartialLaw', 'MilitaryTribunals', 'DeepState']",133
2020-02-23 16:02:00,"#Coronavirus latest: Virus did NOT originate in #Wuhan seafood market, claims study https://t.co/hCR0Z8HX1G https://t.co/NlCmUAtH0F",Daily_Express,"['Coronavirus', 'Wuhan']",818953
2020-02-23 16:01:36,Don't think it was a coincidence #DeanKoontz Novel Predicted #Wuhan #Coronavirus 40 yrs ago #TheGreatAwakening #TheStorm #Qanon #Obamagate #fakenews #mockingbirdmedia is helping #Trump to win again #FutureProvesPast #WWG1WGA #WWG1WGAWorldWide https://t.co/mIoP7SiE5E via @YouTube,mamacriJKS,"['DeanKoontz', 'Wuhan', 'Coronavirus', 'TheGreatAwakening', 'TheStorm', 'Qanon', 'Obamagate', 'fakenews', 'mockingbirdmedia', 'Trump', 'FutureProvesPast', 'WWG1WGA', 'WWG1WGAWorldWide']",247
2020-02-23 16:00:01,Rocket in the sky near wuhan. #COVID #COVID19 #China #wuhan #冠状病毒 #coronavirus #CoronavirusOutbreak #Wuhan #coronaviruschina #coronavirusaustralia #CoronaVirusCanada,Esmerda9,"['COVID', 'COVID19', 'China', 'wuhan', '冠状病毒', 'coronavirus', 'CoronavirusOutbreak', 'Wuhan', 'coronaviruschina', 'coronavirusaustralia', 'CoronaVirusCanada']",1128
2020-02-23 16:00:00,"Video from Hubei province shows doctors running across the street to take patients who are critically ill with #coronavirus to a new ICU unit. It took 30 minutes per patient, 10 in total. #COVID #COVID19 #China #wuhan #冠状病毒 #coronavirus #CoronavirusOutbreak #Wuhan",RoutVanna,"['coronavirus', 'COVID', 'COVID19', 'China', 'wuhan', '冠状病毒', 'coronavirus', 'CoronavirusOutbreak', 'Wuhan']",495
2020-02-23 15:59:25,Coronavirus: Sixth death in South Korea as alert level raised to highest #nCoV2019 #COVID19 #coronavirus #SouthKorea #wuhan #china #emergency #HealthEmergency #quarantine #epidemic https://t.co/GSHSrcg9OW,arquisze,"['nCoV2019', 'COVID19', 'coronavirus', 'SouthKorea', 'wuhan', 'china', 'emergency', 'HealthEmergency', 'quarantine', 'epidemic']",393
2020-02-23 15:59:17,"Supllies Sent To China And Within, Hoarded By Bad Actors Or Destroyed  Stop feeding Bottomless Pit?  #COVID19 #Avenatti #Wetsuweten #onpoli #cdnpoli #Coronavirus #China #Wuhan #FreeChina #XiJinping #Pandemic #BiologicalWarfare #Quarantine #MartialLaw #MilitaryTribunals #DeepState https://t.co/mpl6VnvHC5",CLajambe,"['COVID19', 'Avenatti', 'Wetsuweten', 'onpoli', 'cdnpoli', 'Coronavirus', 'China', 'Wuhan', 'FreeChina', 'XiJinping', 'Pandemic', 'BiologicalWarfare', 'Quarantine', 'MartialLaw', 'MilitaryTribunals', 'DeepState']",133
2020-02-23 15:59:12,Screaming Chinese Reporter in Wuhan #wuhan #coronavirus #letterfromwuhan https://t.co/e1vm3Ji58k via @YouTube,bluhock88,"['wuhan', 'coronavirus', 'letterfromwuhan']",292
2020-02-23 15:58:24,Coronavirus: Sixth death in South Korea as alert level raised to highest #nCoV2019 #COVID19 #coronavirus #SouthKorea #wuhan #china #emergency #HealthEmergency #quarantine #epidemic https://t.co/1WZyKZEVY8 https://t.co/drHmU1AUWH,yamkin1,"['nCoV2019', 'COVID19', 'coronavirus', 'SouthKorea', 'wuhan', 'china', 'emergency', 'HealthEmergency', 'quarantine', 'epidemic']",1973
2020-02-23 15:54:08,"#Coronavirus did not originate in #Wuhan seafood market, scientists say  https://t.co/goBTYXT6H9",twolighteyes,"['Coronavirus', 'Wuhan']",9676
2020-02-23 15:50:00,One of the most poorly produced propaganda videos ever made! This was actually posted to show people that everything is under control but they look like teenagers in costume #COVID #COVID19 #China #wuhan #冠状病毒 #coronavirus #CoronavirusOutbreak #Wuhan #coronaviruschina,Esmerda9,"['COVID', 'COVID19', 'China', 'wuhan', '冠状病毒', 'coronavirus', 'CoronavirusOutbreak', 'Wuhan', 'coronaviruschina']",1128
2020-02-23 15:49:39,"#Coronavirus: #Wuhan to #Quarantine all cured patients 14 days after some test positive again.   #COVID disease progression even in the ""asymptomatic"" may be a slow grind. Do people recover 100%? Reinfection possible. Truly a hell virus.   https://t.co/BX44HojLHc",ContagionTrack,"['Coronavirus', 'Wuhan', 'Quarantine', 'COVID']",2628
2020-02-23 15:48:35,"Xia Sisi a 29-year-old female doctor died from #COVID19 in #Wuhan Sunday morning, according to Wuhan Union Jiangbei Hospital. The gastroenterologist became infected with #coronavirus when treating a patient https://t.co/vXPIq00leu",Kyu_Tano,"['COVID19', 'Wuhan', 'coronavirus']",115
2020-02-23 15:48:09,#Coronavirus #Wuhan to quarantine all cured patients after some test positive  https://t.co/UcNFs3u0V1,krishnakant_75,"['Coronavirus', 'Wuhan']",757
2020-02-23 15:46:23,"Many young people not just older.. A 42-year-old doctor at a Chinese hospital near #Wuhan, Huang Wenjun has died due to #Covid19. He's the 2nd doctor to die in less than 24 hours. There are over 500 reported deaths of Chinese doctors, nurses+their families. #SARSCoV2 #Coronavirus https://t.co/gnm4Tcfkfy",NetworksManager,"['Wuhan', 'Covid19', 'SARSCoV2', 'Coronavirus']",107441
2020-02-23 15:45:57,"#Coronavirus : #Wuhan to quarantine all CURED patients for 14 days after some test positive AGAIN  ▪️A new twist, not encouraging 😔🙏🏼 https://t.co/Wbd2OkJokj",Lin_ling_88,"['Coronavirus', 'Wuhan']",3320
