timestamp,tweet_text,username,all_hashtags,followers_count
2020-02-20 03:46:06,"@nCoVSurviving Hiding #coronavirus may be punishable by death, China court says  https://t.co/j9jYwPHFAT  #COVID19 #SARSCoV2 #outbreak #Wuhan  #China #pandemic #USA #Australia #UK #Japan #Singapore #California #Texas #Georgia #NYC #Florida #Hawaii #Chicago #HongKong #2019nCoV #CDC #US #NYC",K_B79,"['coronavirus', 'COVID19', 'SARSCoV2', 'outbreak', 'Wuhan', 'China', 'pandemic', 'USA', 'Australia', 'UK', 'Japan', 'Singapore', 'California', 'Texas', 'Georgia', 'NYC', 'Florida', 'Hawaii', 'Chicago', 'HongKong', '2019nCoV', 'CDC', 'US', 'NYC']",2630
2020-02-20 03:41:58,Watch @CGTNOfficial's broadcast: Live: Construction of #Wuhan's Leishenshan prefab hospital for #coronavirus patients continues #COVID19 - Why this no progress?  - Wf https://t.co/U2gW1aKu2m,Wandafay,"['Wuhan', 'coronavirus', 'COVID19']",7966
2020-02-20 03:40:46,"Live updates: #Coronavirus claims lives of two passengers from #DiamondPrincess cruise ship, Japanese media says https://t.co/qBoGtcDm0K #Wuhan",Ingvald1,"['Coronavirus', 'DiamondPrincess', 'Wuhan']",893
2020-02-20 03:40:00,"Watch | Families of Pakistanis stranded in China protest  Over 1,000 students stuck; #Pakistan's ignorance continues  More on this by @akankshaswarups   #coronavirus #Wuhan https://t.co/daztghfnHL",WIONews,"['Pakistan', 'coronavirus', 'Wuhan']",92593
2020-02-20 03:37:18,"#Wuhan under quarantine, #Beijing streets are empty and half of #China population is quarantined. Still #CPC and #XiJinping wants me to believe that only 2000 persons have died. #coronavirus #coronaviruschina  https://t.co/MR0iz656Zq",TheSoupOfLife,"['Wuhan', 'Beijing', 'China', 'CPC', 'XiJinping', 'coronavirus', 'coronaviruschina']",287
2020-02-20 03:36:36,#Nanning a sampling of #china aviation   #coronavirus #ChinaCoronaVirus #Corona #china #WuhanCoronavirus #coronaviruschina #WuhanOutbreak  #WuhanPneumonia  #Wuhan #CoronaVirusOutbreak #CCP #ncov2020 #CoronaVirusFacts #COVID19 #VirusCorona #outbreak #virusoutbreak https://t.co/ALsaY5xBeJ,josephthavaraja,"['Nanning', 'china', 'coronavirus', 'ChinaCoronaVirus', 'Corona', 'china', 'WuhanCoronavirus', 'coronaviruschina', 'WuhanOutbreak', 'WuhanPneumonia', 'Wuhan', 'CoronaVirusOutbreak', 'CCP', 'ncov2020', 'CoronaVirusFacts', 'COVID19', 'VirusCorona', 'outbreak', 'virusoutbreak']",99
2020-02-20 03:35:28,Zero new cases in #Xiamen for 3rd day #coronavirus #ChinaCoronaVirus #Corona #china #WuhanCoronavirus #coronaviruschina #WuhanOutbreak  #WuhanPneumonia  #Wuhan #CoronaVirusOutbreak #CCP #ncov2020 #CoronaVirusFacts #COVID19 #VirusCorona #outbreak #virusoutbreak https://t.co/WcJAOnwQc9,josephthavaraja,"['Xiamen', 'coronavirus', 'ChinaCoronaVirus', 'Corona', 'china', 'WuhanCoronavirus', 'coronaviruschina', 'WuhanOutbreak', 'WuhanPneumonia', 'Wuhan', 'CoronaVirusOutbreak', 'CCP', 'ncov2020', 'CoronaVirusFacts', 'COVID19', 'VirusCorona', 'outbreak', 'virusoutbreak']",99
2020-02-20 03:35:14,Now Mr. Iwata is explaining the situation about coronavirus in Diamond Princess in a live broadcast.  #coronavirus #diamondprincesscruise #wuhan #hubei #COVID  https://t.co/RCbblvegOI,eiki1212,"['coronavirus', 'diamondprincesscruise', 'wuhan', 'hubei', 'COVID']",175
2020-02-20 03:35:13,Major Supply Chain Disruptions Happening - Coronavirus Impacts Everyone | Ethan Galstad. #CoronarvirusOutbreak #coronavirus #COVID19 #china #Wuhan #WuhanCoronavirus   https://t.co/Xh7KcZYsc2,ArtOfTheMakina,"['CoronarvirusOutbreak', 'coronavirus', 'COVID19', 'china', 'Wuhan', 'WuhanCoronavirus']",4
2020-02-20 03:32:29,"videochinatv: ""TCM had been proved effective in treating mild cases."" said Zhang Boli, an academician of Chinese Academy of Engineering. #TCM #China #Wuhan #COVID19 #coronavirus https://t.co/z7MEdAr9Tw via  @YouTube",ChinaObserver2,"['TCM', 'China', 'Wuhan', 'COVID19', 'coronavirus']",133
2020-02-20 03:32:12,Taiwan lawmaker: “The situation is not transparent. We can foresee that Taiwanese who were forced to go back to work in China are facing tremendous instability and life-threatening risks.” #Wuhan #coronavirus #COVID19,skylark1984,"['Wuhan', 'coronavirus', 'COVID19']",1649
2020-02-20 03:32:11,"“Many Taiwanese firms with operations in mainland China are nervous about returning to work, but were forced by local authorities to reopen.” #COVID19 #Wuhan #coronavirus",skylark1984,"['COVID19', 'Wuhan', 'coronavirus']",1649
2020-02-20 03:32:09,"“Some local authorities have resorted to deploying police, who enter company premises and force them to operate. Others have hired chartered planes and buses to pick up migrant workers...transport them to work in major cities.” #Wuhan #coronavirus #COVID19",skylark1984,"['Wuhan', 'coronavirus', 'COVID19']",1649
2020-02-20 03:32:07,"Good Lord. First China quarantines under threat of jail, now they’re forcing companies to resume operations. Flip. Flop. Did we miss something?   #COVID19 #Wuhan #coronavirus  https://t.co/jpg8wNbQMj",skylark1984,"['COVID19', 'Wuhan', 'coronavirus']",1649
2020-02-20 03:31:30,This woman’s call for help should be heard around the world. This is what happens under socialist/communist regimes. I pray for her. #Wuhan #COVIDー19 #coronavirus #politics #china #fuckchina #freethepeople #hongkong https://t.co/WA60UJcjo9,OfficialLRTM,"['Wuhan', 'COVIDー19', 'coronavirus', 'politics', 'china', 'fuckchina', 'freethepeople', 'hongkong']",8
2020-02-20 03:30:29,Why call it COVID-19? It should be called Wuhan virus or Kung Flu. #COVID19 #Wuhan #Coronavirus,ZombieSkrilla,"['COVID19', 'Wuhan', 'Coronavirus']",51
2020-02-20 03:30:00,Map shows how Wuhan travellers spread Coronavirus globally.... #Coronavirus #Wuhan #China #COVID19 #CoronavirusOutbreak #CoronavirusChina #COVID #WuhanCoronavirus #Corona https://t.co/ThkywuZuLA,TPE_connect,"['Coronavirus', 'Wuhan', 'China', 'COVID19', 'CoronavirusOutbreak', 'CoronavirusChina', 'COVID', 'WuhanCoronavirus', 'Corona']",617
2020-02-20 03:27:02,"China has deployed at least 40 industrial incinerators at the epicentre of #coronavirus outbreak in #Wuhan. The machines, can reportedly handle about five tons of material per day, are either being used to dispose of dead bodies or medical waste. https://t.co/XaK5wQSjvm",TheSoupOfLife,"['coronavirus', 'Wuhan']",287
2020-02-20 03:25:54,"India to evacuate some Myanmar nationals from #coronavirus hit #Wuhan city, onboard C17 aircraft of @IAF_MCC which is being sent today with medical relief material to China.Special aircraft will bring many indians who cud'nt come during earlier evacuations.https://t.co/xS6nBRfD0l",veergarg,"['coronavirus', 'Wuhan']",36
2020-02-20 03:21:47,2/18/17 https://t.co/aGhaGz8hGg Why didn't Charles M. Lieber and other academics see this coming to corrupt collaborators with the Chinese who brought us the new #coronavirus pathology from #Wuhan.,microRNApro,"['coronavirus', 'Wuhan']",748
2020-02-20 03:20:21,#coronavirus #fitness  #Beijing stays fit  #ChinaCoronaVirus #Corona #china #WuhanCoronavirus #coronaviruschina #WuhanOutbreak  #WuhanPneumonia  #Wuhan #CoronaVirusOutbreak #CCP #ncov2020 #CoronaVirusFacts #COVID19 #VirusCorona #outbreak #virusoutbreak https://t.co/D0ZOsIx9Mz,josephthavaraja,"['coronavirus', 'fitness', 'Beijing', 'ChinaCoronaVirus', 'Corona', 'china', 'WuhanCoronavirus', 'coronaviruschina', 'WuhanOutbreak', 'WuhanPneumonia', 'Wuhan', 'CoronaVirusOutbreak', 'CCP', 'ncov2020', 'CoronaVirusFacts', 'COVID19', 'VirusCorona', 'outbreak', 'virusoutbreak']",99
2020-02-20 03:20:08,#Taiwan confirms 24th case of #Wuhan #coronavirus. CECC is investigating how virus was transmitted to woman with no recent history of travel https://t.co/fwGg2Iyg4P https://t.co/hJle4h8BA2,TaiwanNews886,"['Taiwan', 'Wuhan', 'coronavirus']",12163
2020-02-20 03:20:03,"Whatever we don't know,  we at least know 1 thing, this virus is going 2 be here a long long time  #SARSCoV2 #covid19 #covid_19 #TerminatorChinaVirus  #nCoV2020 #nCoV2019 #2019_nCov #2019nCoV   #coronavirusoutbreak  #coronavirus  #coronaviruschina  #Wuhan #WuhanPneumonia #China https://t.co/wmIYMvP0F2",FredWilliams77,"['SARSCoV2', 'covid19', 'covid_19', 'TerminatorChinaVirus', 'nCoV2020', 'nCoV2019', '2019_nCov', '2019nCoV', 'coronavirusoutbreak', 'coronavirus', 'coronaviruschina', 'Wuhan', 'WuhanPneumonia', 'China']",3975
2020-02-20 03:17:03,"""It is going to be OK, and I am not worried,"" a 60-year-old retired worker in Wuhan said. ""Throughout history, #Wuhan has suffered a lot of disasters, such as the great flood in 1998, but every time we have overcome them.""  #coronavirus #COVID19",Ademola85644569,"['Wuhan', 'coronavirus', 'COVID19']",16
2020-02-20 03:15:00,"""It is going to be OK, and I am not worried,"" a 60-year-old retired worker in Wuhan said. ""Throughout history, #Wuhan has suffered a lot of disasters, such as the great flood in 1998, but every time we have overcome them.""  #coronavirus #COVID19",ChinaDaily,"['Wuhan', 'coronavirus', 'COVID19']",4286374
2020-02-20 03:14:19,#Asia calls for #china flight ban  #airtravel  #coronavirus #ChinaCoronaVirus #Corona #china #WuhanCoronavirus #coronaviruschina #WuhanOutbreak  #WuhanPneumonia  #Wuhan #CoronaVirusOutbreak #CCP #ncov2020 #CoronaVirusFacts #COVID19 #VirusCorona #outbreak #virusoutbreak https://t.co/EAZtLnumpP,josephthavaraja,"['Asia', 'china', 'airtravel', 'coronavirus', 'ChinaCoronaVirus', 'Corona', 'china', 'WuhanCoronavirus', 'coronaviruschina', 'WuhanOutbreak', 'WuhanPneumonia', 'Wuhan', 'CoronaVirusOutbreak', 'CCP', 'ncov2020', 'CoronaVirusFacts', 'COVID19', 'VirusCorona', 'outbreak', 'virusoutbreak']",99
2020-02-20 03:14:00,"#Japanese health authorities confirmed 88 more cases of #Coronavirus on a quarantined #DiamondPrincess cruise ship, bringing the total 542. The number is by far the largest outside China. #COVID #COVID19 #China #wuhan #冠状病毒 #coronavirus",Sreyrot79159121,"['Japanese', 'Coronavirus', 'DiamondPrincess', 'COVID', 'COVID19', 'China', 'wuhan', '冠状病毒', 'coronavirus']",1535
2020-02-20 03:13:04,"Tedros, You're fired! ✒⬇ https://t.co/NkaCos8Ld5 #coronaviruschina #Pndahugger #coronachan #corona_chan #コロナちゃん #コロナウイルスちゃん #WuhanVirus #武漢 #coronavirus_chan #Ebola #ebolachan #ebola_chan #エボラちゃん #WuhanCoronavirus #Wuhan #coronavirusoutbreak #coronavirus",Corona_chan_,"['coronaviruschina', 'Pndahugger', 'coronachan', 'corona_chan', 'コロナちゃん', 'コロナウイルスちゃん', 'WuhanVirus', '武漢', 'coronavirus_chan', 'Ebola', 'ebolachan', 'ebola_chan', 'エボラちゃん', 'WuhanCoronavirus', 'Wuhan', 'coronavirusoutbreak', 'coronavirus']",6302
2020-02-20 03:12:42,#coronavirus here to stay- will not die like #sars but will remain like influenza to infect humanity   #ChinaCoronaVirus #Corona #china #WuhanCoronavirus #coronaviruschina #WuhanOutbreak  #WuhanPneumonia  #Wuhan #CoronaVirusOutbreak #CCP #ncov2020 #CoronaVirusFacts #COVID19 https://t.co/com1m2Y5Wr,josephthavaraja,"['coronavirus', 'sars', 'ChinaCoronaVirus', 'Corona', 'china', 'WuhanCoronavirus', 'coronaviruschina', 'WuhanOutbreak', 'WuhanPneumonia', 'Wuhan', 'CoronaVirusOutbreak', 'CCP', 'ncov2020', 'CoronaVirusFacts', 'COVID19']",99
2020-02-20 03:11:13,"Head nurse Cai Liping of #Wuchang Hospital died of #coronavirus infection in #Wuhan. When the van transporting her body drove away, a man tried to grab the van and see her one last time That's her husband, a doctor working for the same hospital -:heartbreaking  #china via Twitter https://t.co/RCq0c9nBEf",Reality_Index,"['Wuchang', 'coronavirus', 'Wuhan', 'china']",108
2020-02-20 03:11:00,"#LiuZhiming, director of the #Wuchang hospital in #Wuhan, died of the #Coronavirus.His death renew criticism that the govt has not done enough to protect frontline medical workers many of them are overworked and overstretched #COVID #COVID19 #China #wuhan #冠状病毒 #coronavirus",Sreyrot79159121,"['LiuZhiming', 'Wuchang', 'Wuhan', 'Coronavirus', 'COVID', 'COVID19', 'China', 'wuhan', '冠状病毒', 'coronavirus']",1535
2020-02-20 03:10:08,"@RallyPoint7 This outbreak is like a slow motion horror movie, where most people r oblivious to the monster that is about to kill them #SARSCoV2 #covid19 #covid_19 #TerminatorChinaVirus  #nCoV2020 #nCoV2019 #2019_nCov #2019nCoV   #coronavirusoutbreak  #coronavirus  #coronaviruschina  #Wuhan",FredWilliams77,"['SARSCoV2', 'covid19', 'covid_19', 'TerminatorChinaVirus', 'nCoV2020', 'nCoV2019', '2019_nCov', '2019nCoV', 'coronavirusoutbreak', 'coronavirus', 'coronaviruschina', 'Wuhan']",3975
2020-02-20 03:09:00,"Meanwhile, 102 #HongKong passengers onboard #DiamondPrincess arrived #HanedaAirport in #Tokyo, they took the govt-chartered flight with 8 health officials back home.  #COVID #COVID19 #China #wuhan #冠状病毒 #coronavirus #CoronavirusOutbreak #Wuhan #coronaviruschina",Sreyrot79159121,"['HongKong', 'DiamondPrincess', 'HanedaAirport', 'Tokyo', 'COVID', 'COVID19', 'China', 'wuhan', '冠状病毒', 'coronavirus', 'CoronavirusOutbreak', 'Wuhan', 'coronaviruschina']",1535
2020-02-20 03:08:54,We need #Total #Transparency by #CCP to ALL health statistics is essential to understand and control this #SARSCoV2 epidemic. #Wuhan #Coronavirus #COVID19 https://t.co/GAVE0fv3uE,DavidLHagen,"['Total', 'Transparency', 'CCP', 'SARSCoV2', 'Wuhan', 'Coronavirus', 'COVID19']",280
2020-02-20 03:05:00,"Now, listen....very, very, carefully..""either naturally caused OR INTENTIONALLY CAUSED."" #COVID #COVID19 #China #wuhan #冠状病毒 #coronavirus #CoronavirusOutbreak #Wuhan #coronaviruschina #coronavirusaustralia",Sreyrot79159121,"['COVID', 'COVID19', 'China', 'wuhan', '冠状病毒', 'coronavirus', 'CoronavirusOutbreak', 'Wuhan', 'coronaviruschina', 'coronavirusaustralia']",1535
2020-02-20 03:03:41,‘This may be the last piece I write’: prominent Xi critic has internet cut after house arrest https://t.co/fuzv4evC2o #Coronavirus #Wuhan,Ingvald1,"['Coronavirus', 'Wuhan']",893
2020-02-20 03:02:53,"10 of the 14 evacuees who tested positive were moved to a hospital in #Omaha, they were retested and monitored in rooms with separate filtration systems at the University of #Nebraska Medical Center. #COVID #COVID19 #China #wuhan #冠状病毒 #coronavirus #CoronavirusOutbreak #Wuhan https://t.co/YXZeePFqt1",PerthWAustralia,"['Omaha', 'Nebraska', 'COVID', 'COVID19', 'China', 'wuhan', '冠状病毒', 'coronavirus', 'CoronavirusOutbreak', 'Wuhan']",3511
2020-02-20 03:01:55,Rep Will Hurd on China’s lack of transparency: “Delaying an understanding of the virus has delayed the development of an effective global response.”   Apparently @WHO is too busy rowing China’s propaganda canoe to notice the lack of reliable data. 🤔 #Wuhan #coronavirus #COVID19,skylark1984,"['Wuhan', 'coronavirus', 'COVID19']",1649
2020-02-20 03:01:55,"“This lack of transparency has come even as the National Academies of Science, Engineering, and Medicine released a letter insisting that the scientific community needs more sequence data and samples to better understand the virus and its origins.” #Wuhan #coronavirus #COVID19",skylark1984,"['Wuhan', 'coronavirus', 'COVID19']",1649
2020-02-20 03:01:55,"Rep Will Hurd @HurdOnTheHill “The U.S. first offered to send expert assistance and resources to China on  Jan. 6, and it took the Chinese government over a month to allow a small advance team of WHO experts into the country.” #Wuhan #coronavirus #COVID19",skylark1984,"['Wuhan', 'coronavirus', 'COVID19']",1649
2020-02-20 03:01:55,“Hurd hit back at China’s accusation that the United States has not done enough or offered assistance to combat the epidemic.” #Wuhan #coronavirus #COVID19,skylark1984,"['Wuhan', 'coronavirus', 'COVID19']",1649
2020-02-20 03:01:54,"Rep. Will Hurd: “I have witnessed firsthand the exemplary efforts being made by the Centers for Disease Control and Prevention (CDC), the Department of Health and Human Services (HHS) and others to ensure the health and safety of all Americans,” #Wuhan #coronavirus #COVID19",skylark1984,"['Wuhan', 'coronavirus', 'COVID19']",1649
2020-02-20 03:01:54,"Rep. Will Hurd @HurdOnTheHill “In their response to this outbreak, the Chinese government’s penchant for secrecy and total government control has threatened the lives of their own citizens and risked the safety of the world.” @WHO are you listening? #Wuhan #coronavirus #COVID19",skylark1984,"['Wuhan', 'coronavirus', 'COVID19']",1649
2020-02-20 03:01:54,"“The number of confirmed cases in China has skyrocketed to over 40,000, and the global death toll has risen to almost 2,000 with all but two of the deaths occurring in mainland China,” said Hurd. #Wuhan #coronavirus #COVID19",skylark1984,"['Wuhan', 'coronavirus', 'COVID19']",1649
2020-02-20 03:01:54,"Rep Will Hurd: “Addressing this crisis must be a global effort, but China’s record of opacity has hindered efforts aimed at understanding its origins and mitigating its effect.” #Wuhan #coronavirus #COVID19",skylark1984,"['Wuhan', 'coronavirus', 'COVID19']",1649
2020-02-20 03:01:00,Rocket in the sky near wuhan. #COVID #COVID19 #China #wuhan #冠状病毒 #coronavirus #CoronavirusOutbreak #Wuhan #coronaviruschina #coronavirusaustralia #CoronaVirusCanada,Sreyrot79159121,"['COVID', 'COVID19', 'China', 'wuhan', '冠状病毒', 'coronavirus', 'CoronavirusOutbreak', 'Wuhan', 'coronaviruschina', 'coronavirusaustralia', 'CoronaVirusCanada']",1535
2020-02-20 03:00:00,Hong Kong reports second coronavirus death as it draws plans to fly stranded residents back from virus-stricken cruise ship in Japan.....  #HongKong #Coronavirus #China #Wuhan #COVID19 #CoronavirusOutbreak https://t.co/4z3iouKOWt,TPE_connect,"['HongKong', 'Coronavirus', 'China', 'Wuhan', 'COVID19', 'CoronavirusOutbreak']",617
2020-02-20 03:00:00,One of the most poorly produced propaganda videos ever made! This was actually posted to show people that everything is under control but they look like teenagers in costume #COVID #COVID19 #China #wuhan #冠状病毒 #coronavirus #CoronavirusOutbreak #Wuhan #coronaviruschina,Sreyrot79159121,"['COVID', 'COVID19', 'China', 'wuhan', '冠状病毒', 'coronavirus', 'CoronavirusOutbreak', 'Wuhan', 'coronaviruschina']",1535
2020-02-20 02:58:00,"If there are human trials for radical vaccines and antiviral drugs being conducted, than that would be a crime against humanity or trying to save it? Thoughts? #COVID #COVID19 #China #wuhan #冠状病毒 #coronavirus #CoronavirusOutbreak #Wuhan #coronaviruschina #coronavirusaustralia",Sreyrot79159121,"['COVID', 'COVID19', 'China', 'wuhan', '冠状病毒', 'coronavirus', 'CoronavirusOutbreak', 'Wuhan', 'coronaviruschina', 'coronavirusaustralia']",1535
2020-02-20 02:56:48,"How do you keep working effectively when many areas of the country are all experiencing some level of lockdown? Luckily, experts hidden in different fields of workplaces have found efficient ways to deal with the situation. https://t.co/0ZZOPKU4oH #coronavirus #wuhan #COVID2019",InChinanow,"['coronavirus', 'wuhan', 'COVID2019']",372
2020-02-20 02:56:00,Police and army march in force on the citizens of China as starving people sneak out for food #COVID #COVID19 #China #wuhan #冠状病毒 #coronavirus #CoronavirusOutbreak #Wuhan #coronaviruschina #coronavirusaustralia #CoronaVirusCanada,Sreyrot79159121,"['COVID', 'COVID19', 'China', 'wuhan', '冠状病毒', 'coronavirus', 'CoronavirusOutbreak', 'Wuhan', 'coronaviruschina', 'coronavirusaustralia', 'CoronaVirusCanada']",1535
2020-02-20 02:55:32,Another #Wuhan hospital chief 'is infected with #coronavirus' a day after a leading doctor died of the disease https://t.co/NmIKGd4kpb,onthesidelinez,"['Wuhan', 'coronavirus']",85
2020-02-20 02:55:23,"10 of the 14 evacuees who tested positive were moved to a hospital in #Omaha, they were retested and monitored in rooms with separate filtration systems at the University of #Nebraska Medical Center. #COVID #COVID19 #China #wuhan #冠状病毒 #coronavirus #CoronavirusOutbreak #Wuhan",Sreyrot79159121,"['Omaha', 'Nebraska', 'COVID', 'COVID19', 'China', 'wuhan', '冠状病毒', 'coronavirus', 'CoronavirusOutbreak', 'Wuhan']",1535
2020-02-20 02:53:05,"Some #HongKong passengers onboard #DiamondPrincess cruise are eager to get on the charter flight; some contracted the #Coronavirus are now isolated in #Japan’s hospital, worrying their families who left onboard the ship.  #COVID #COVID19 #China #wuhan #冠状病毒 #coronavirus",Sreyrot79159121,"['HongKong', 'DiamondPrincess', 'Coronavirus', 'Japan', 'COVID', 'COVID19', 'China', 'wuhan', '冠状病毒', 'coronavirus']",1535
2020-02-20 02:53:03,"I’ll believe you when you show real footage from the #Wuhan lab, handling bats and other creatures, not this sanitized video of an anonymous lab.. #coronavirus https://t.co/e2AQ1v9UDZ",RitasArtCafe,"['Wuhan', 'coronavirus']",7193
2020-02-20 02:51:35,"@SCMPNews I’ll believe you when you show real footage from the #Wuhan lab, handling bats and other creatures, not this sanitized video of an anonymous lab.. #coronavirus",RitasArtCafe,"['Wuhan', 'coronavirus']",7193
2020-02-20 02:50:37,"#Iran reported 2 #Coronavirus deaths (updated). Meanwhile 79 new cases confirmed onboard #DiamondPrincess bringing the total 624, and around 500 passengers who tested negative were disembarked. #COVID #COVID19 #China #wuhan #冠状病毒 #coronavirus #CoronavirusOutbreak #Wuhan",Sreyrot79159121,"['Iran', 'Coronavirus', 'DiamondPrincess', 'COVID', 'COVID19', 'China', 'wuhan', '冠状病毒', 'coronavirus', 'CoronavirusOutbreak', 'Wuhan']",1535
2020-02-20 02:50:00,Coronavirus China: Man runs marathon inside apartment amidst lockdown... || #Coronavirus #Wuhan #China #COVID #CoronavirusOutbreak #CoronavirusChina #Corona #WuhanCoronavirus #COVID19 https://t.co/hPGlqbc4jf,TPE_connect,"['Coronavirus', 'Wuhan', 'China', 'COVID', 'CoronavirusOutbreak', 'CoronavirusChina', 'Corona', 'WuhanCoronavirus', 'COVID19']",617
2020-02-20 02:48:17,"BREAKING: Many leading Chinese scientists are starting to speak out and say #COVID19 #coronavirus originated at a government bioweapons research facility in #Wuhan, rather than the widely-held belief that it emerged from the city's Huanan seafood markets. https://t.co/AJYCOq6qGT",Sanjay_Vis,"['COVID19', 'coronavirus', 'Wuhan']",106791
2020-02-20 02:47:05,"It's very clear Japanse authority does not have enough experience to handle such a severe virus issue. The health authority hit back ""It's a misconception. ""  #coronavirus #Japan #Diamond_Princess #Wuhan #hubei https://t.co/bjDmmGYAjg",eiki1212,"['coronavirus', 'Japan', 'Diamond_Princess', 'Wuhan', 'hubei']",175
2020-02-20 02:46:49,@jenniferatntd 3 Remote-viewers working blind target #COVID19 Amazing accuracy. An inside look at #Wuhan lab. #coronavirus   https://t.co/yNlrP564ch https://t.co/Ptw2y9pJws,gmonmouth1,"['COVID19', 'Wuhan', 'coronavirus']",73
2020-02-20 02:46:26,"They are burning 1,200 bodies a Day😱 #Coronavirus #COVID #COVID19 #China #wuhan #冠状病毒 #coronavirus #CoronavirusOutbreak #Wuhan #coronaviruschina #coronavirusaustralia",Sreyrot79159121,"['Coronavirus', 'COVID', 'COVID19', 'China', 'wuhan', '冠状病毒', 'coronavirus', 'CoronavirusOutbreak', 'Wuhan', 'coronaviruschina', 'coronavirusaustralia']",1535
2020-02-20 02:44:30,"The Communist Party of China will beat you and put you in jail if you don’t wear face mask in public, part 2 #coronavirusOutbreak #COVID19 #SARSCoV2 #WuhanCoronavirus #2019nCoV #coronavirus #wuhan",Sreyrot79159121,"['coronavirusOutbreak', 'COVID19', 'SARSCoV2', 'WuhanCoronavirus', '2019nCoV', 'coronavirus', 'wuhan']",1535
2020-02-20 02:43:50,From a friend who read this #DeanKoontz novel #wuhan #coronavirus https://t.co/RmHXvB9EaT,JeannineRiviere,"['DeanKoontz', 'wuhan', 'coronavirus']",3954
2020-02-20 02:43:14,"Last night, people from Qingshan District in #Wuhan taken to No. 2 Hospital of Wuhan Iron &amp; Steel Corp to be ""educated"" after being caught for walking on the street amid coronavirus outbreak. #COVID19 #Coronavirus #COVID #COVID19 #China #wuhan #冠状病毒 #coronavirus",Sreyrot79159121,"['Wuhan', 'COVID19', 'Coronavirus', 'COVID', 'COVID19', 'China', 'wuhan', '冠状病毒', 'coronavirus']",1535
2020-02-20 02:40:35,This is so sad. Praying for everyone 🙏  #SARSCoV2 #covid19 #covid_19 #TerminatorChinaVirus  #nCoV2020 #nCoV2019 #2019_nCov #2019nCoV   #coronavirusoutbreak  #coronavirus  #coronaviruschina  #Wuhan #WuhanPneumonia #China #WuhanSARS #ChinaCoronaVirus #pandemic https://t.co/j9kPyVRk3S,FredWilliams77,"['SARSCoV2', 'covid19', 'covid_19', 'TerminatorChinaVirus', 'nCoV2020', 'nCoV2019', '2019_nCov', '2019nCoV', 'coronavirusoutbreak', 'coronavirus', 'coronaviruschina', 'Wuhan', 'WuhanPneumonia', 'China', 'WuhanSARS', 'ChinaCoronaVirus', 'pandemic']",3975
2020-02-20 02:37:58,China Doesn't Have This Under Control #Wuhan #COVID2019 #coronavirus #RenditionUFlu https://t.co/xCmyPnJ5Uv via @YouTube,idannyb,"['Wuhan', 'COVID2019', 'coronavirus', 'RenditionUFlu']",2560
2020-02-20 02:37:54,The mafia are given police vests and decide to round up the competition... #COVID #COVID19 #China #wuhan #冠状病毒 #coronavirus #CoronavirusOutbreak #Wuhan #coronaviruschina #coronavirusaustralia #CoronaVirusCanada,Sreyrot79159121,"['COVID', 'COVID19', 'China', 'wuhan', '冠状病毒', 'coronavirus', 'CoronavirusOutbreak', 'Wuhan', 'coronaviruschina', 'coronavirusaustralia', 'CoronaVirusCanada']",1535
2020-02-20 02:35:48,Rule of law Police collect protection money from shop keeper... #COVID #COVID19 #China #wuhan #冠状病毒 #coronavirus #CoronavirusOutbreak #Wuhan #coronaviruschina #coronavirusaustralia #CoronaVirusCanada,Sreyrot79159121,"['COVID', 'COVID19', 'China', 'wuhan', '冠状病毒', 'coronavirus', 'CoronavirusOutbreak', 'Wuhan', 'coronaviruschina', 'coronavirusaustralia', 'CoronaVirusCanada']",1535
