timestamp,tweet_text,username,all_hashtags,followers_count
2020-02-20 03:46:06,"@nCoVSurviving Hiding #coronavirus may be punishable by death, China court says  https://t.co/j9jYwPHFAT  #COVID19 #SARSCoV2 #outbreak #Wuhan  #China #pandemic #USA #Australia #UK #Japan #Singapore #California #Texas #Georgia #NYC #Florida #Hawaii #Chicago #HongKong #2019nCoV #CDC #US #NYC",K_B79,"['coronavirus', 'COVID19', 'SARSCoV2', 'outbreak', 'Wuhan', 'China', 'pandemic', 'USA', 'Australia', 'UK', 'Japan', 'Singapore', 'California', 'Texas', 'Georgia', 'NYC', 'Florida', 'Hawaii', 'Chicago', 'HongKong', '2019nCoV', 'CDC', 'US', 'NYC']",2630
2020-02-20 03:36:10,We need a new marriage vow now...😅  #Coronavirus #COVID19 #China #HongKong #MarriageStory #Poem #poetrycommunity #poetry https://t.co/x7OIrhHXlC,HYWong31733319,"['Coronavirus', 'COVID19', 'China', 'HongKong', 'MarriageStory', 'Poem', 'poetrycommunity', 'poetry']",6
2020-02-20 03:31:30,This woman’s call for help should be heard around the world. This is what happens under socialist/communist regimes. I pray for her. #Wuhan #COVIDー19 #coronavirus #politics #china #fuckchina #freethepeople #hongkong https://t.co/WA60UJcjo9,OfficialLRTM,"['Wuhan', 'COVIDー19', 'coronavirus', 'politics', 'china', 'fuckchina', 'freethepeople', 'hongkong']",8
2020-02-20 03:31:26,Only way to get authentic #WuhanCoronavirus spread/casualty ratio is by analysing nmbrs coming fm #SouthKorea #Hongkong #Singapore #Japan etc. Not to forget #DiamondPrincess #Westerdam too. Reliance on #China's nmbrs is fooling ppl. That's wat @WHO @UN doing so far. #coronavirus,CaptAKJ,"['WuhanCoronavirus', 'SouthKorea', 'Hongkong', 'Singapore', 'Japan', 'DiamondPrincess', 'Westerdam', 'China', 'coronavirus']",537
2020-02-20 03:29:48,"#Coronavirus #UK travel advice: Foreign Office guidelines for #Thailand, #HongKong, #China, #Japan and beyond   @theipaper  https://t.co/8RaTF4gC37",GlobalNewsTH,"['Coronavirus', 'UK', 'Thailand', 'HongKong', 'China', 'Japan']",5531
2020-02-20 03:13:40,Singtao owner that was banned to come to NY! He made these 2 pages just to tell people what Carrie Lam did to HK people! #HongKong. #coronavirus #HKGov #StayStrongHK #supporthk #antielab https://t.co/lkvdtti4gj,Tammy14123942,"['HongKong', 'coronavirus', 'HKGov', 'StayStrongHK', 'supporthk', 'antielab']",25
2020-02-20 03:09:00,"Meanwhile, 102 #HongKong passengers onboard #DiamondPrincess arrived #HanedaAirport in #Tokyo, they took the govt-chartered flight with 8 health officials back home.  #COVID #COVID19 #China #wuhan #冠状病毒 #coronavirus #CoronavirusOutbreak #Wuhan #coronaviruschina",Sreyrot79159121,"['HongKong', 'DiamondPrincess', 'HanedaAirport', 'Tokyo', 'COVID', 'COVID19', 'China', 'wuhan', '冠状病毒', 'coronavirus', 'CoronavirusOutbreak', 'Wuhan', 'coronaviruschina']",1535
2020-02-20 03:02:58,"106 of the 364 Hongkongers who were stuck on the quarantined Diamond Princess cruise in Japan for more than two weeks finally arrived back in the city this morning, and were sent straight to a quarantine facility in Fo Tan for 14 days. #coronavirus #hongkong #quarantine https://t.co/JY6aT71ozI",eyepressnews,"['coronavirus', 'hongkong', 'quarantine']",6372
2020-02-20 03:00:07,"Good day, everyone!  Here’s a very good doggie.   #HongKong  #KeepSafe😷 #coronavirus https://t.co/1A1ri0rE65",StMajestyk,"['HongKong', 'KeepSafe', 'coronavirus']",102
2020-02-20 03:00:00,Hong Kong reports second coronavirus death as it draws plans to fly stranded residents back from virus-stricken cruise ship in Japan.....  #HongKong #Coronavirus #China #Wuhan #COVID19 #CoronavirusOutbreak https://t.co/4z3iouKOWt,TPE_connect,"['HongKong', 'Coronavirus', 'China', 'Wuhan', 'COVID19', 'CoronavirusOutbreak']",617
2020-02-20 02:53:05,"Some #HongKong passengers onboard #DiamondPrincess cruise are eager to get on the charter flight; some contracted the #Coronavirus are now isolated in #Japan’s hospital, worrying their families who left onboard the ship.  #COVID #COVID19 #China #wuhan #冠状病毒 #coronavirus",Sreyrot79159121,"['HongKong', 'DiamondPrincess', 'Coronavirus', 'Japan', 'COVID', 'COVID19', 'China', 'wuhan', '冠状病毒', 'coronavirus']",1535
2020-02-20 02:51:07,"#Cambodia Ministry of Health said as of today (Thursday) 1286 #Westerdam passengers tested #Coronavirus #Covid_19  NEGATIVE, 20 days after the ship left #HongKong",Chhengniem,"['Cambodia', 'Westerdam', 'Coronavirus', 'Covid_19', 'HongKong']",1040
2020-02-20 02:36:10,Trains be ghost these days👻  #ThisIsHongKong #coronavirus  #TravelPhotography #travel #StreetPhotography #HongKong #iphoneography #photojournalism #streetphotographer #iphone11 https://t.co/xC5YKGCzi4,bmactravelogues,"['ThisIsHongKong', 'coronavirus', 'TravelPhotography', 'travel', 'StreetPhotography', 'HongKong', 'iphoneography', 'photojournalism', 'streetphotographer', 'iphone11']",29
2020-02-20 02:21:05,"More than 100 #HongKong residents who were quarantined on the Diamond Princess cruise in #Japan for over two weeks landed on Thursday morning in the Asian financial hub, where they will face a further 14 days of quarantine.  #coronavirus https://t.co/3lR6FvHguc",Apex_WW,"['HongKong', 'Japan', 'coronavirus']",2124
2020-02-20 02:14:03,"And over a hundred joined a rally at #LeiChengUkEstate, #CheungShaWan yesterday, residents also angry about #HongKong govt assign designated outpatient clinic for #Coronavirus patients in residential area. #COVID #COVID19 #China #wuhan #冠状病毒",Mina32134295,"['LeiChengUkEstate', 'CheungShaWan', 'HongKong', 'Coronavirus', 'COVID', 'COVID19', 'China', 'wuhan', '冠状病毒']",501
2020-02-20 02:07:48,"#HongKong govt planned to set up quarantine facilities for #Coronavirus, 3 of them located in #SaiKung. Residents in the district had a rally in town centre yesterday against govt’s reckless decision, said the facilities just a block away from residential area.",Mina32134295,"['HongKong', 'Coronavirus', 'SaiKung']",501
2020-02-20 01:58:12,"Here comes #HongKong police college joined the #CCP propaganda army, to “encourage #Coronavirus epidemic control in #Wuhan”, gosh they spoke mandarin....  @StandNewsHK  #香港警察學院加入9叫武漢加油 #仲要講國語🤢 https://t.co/yMQ1uN9ruv",nikki_miumiu,"['HongKong', 'CCP', 'Coronavirus', 'Wuhan', '香港警察學院加入9叫武漢加油', '仲要講國語']",9774
2020-02-20 01:54:21,"One new confirmed case of #Coronavirus added in #HongKong, the 54-yr-old male with no travel  record have seen the doc for 6 times in 9 days, hospital once failed to diagnose him.  Health officials sanitised the building where he lives in #TaiKooShing after diagnosed.",Mina32134295,"['Coronavirus', 'HongKong', 'TaiKooShing']",501
2020-02-20 01:26:47,#HongKong first Filipino domestic worker infected with #coronavirus ‘in good spirits’ https://t.co/oIGf7qANwz,BrianRhoadsHK,"['HongKong', 'coronavirus']",5515
2020-02-20 01:05:03,#HongKong: The Immigration Department (ImmD) has announced it will continue to limit services this week in response to the #coronavirus. Read more: https://t.co/RCI7qmYszr #immigration #globalmobility,BAL_Immigration,"['HongKong', 'coronavirus', 'immigration', 'globalmobility']",4519
2020-02-20 01:02:00,"Asian countries anxious over virus, want China flight ban: new poll https://t.co/xI52Mfuomy via @scmpnews #japan #coronavirus #china #hongkong",karldotcom,"['japan', 'coronavirus', 'china', 'hongkong']",920
2020-02-20 01:00:58,Nightmare cruise finally over for 106 Hong Kong passengers https://t.co/mJrTpBWkZh via @scmpnews #hongkong #coronavirus,karldotcom,"['hongkong', 'coronavirus']",920
2020-02-20 01:00:00,Hong Kong reports second coronavirus death as it draws plans to fly stranded residents back from virus-stricken cruise ship in Japan....  #HongKong #Coronavirus #China #Wuhan #COVID19 #CoronavirusOutbreak https://t.co/4z3iov2ql3,TPE_connect,"['HongKong', 'Coronavirus', 'China', 'Wuhan', 'COVID19', 'CoronavirusOutbreak']",617
2020-02-20 00:59:41,"Qantas and Jetstar cut Asia flights, including to Hong Kong, Singapore https://t.co/EQalNP865d via @scmpnews #hongkong #coronavirus #singapore",karldotcom,"['hongkong', 'coronavirus', 'singapore']",920
2020-02-20 00:23:41,"At #Yokohama #Japan, #HongKong arranged a flight and buses by the tax we paid, to evacuate HongKongers on #DiamondPrincess  cruise. And #China consulate took this chance for its propaganda. Rubbish country, absolutely rubbish. #Coronavirus #WuHan  #WuHanPneumonia #ChinaVirus https://t.co/eiCNrEVQ1F",WickyWong3,"['Yokohama', 'Japan', 'HongKong', 'DiamondPrincess', 'China', 'Coronavirus', 'WuHan', 'WuHanPneumonia', 'ChinaVirus']",7
2020-02-20 00:21:18,"Qantas confirms it will cut flights to mainland #China, #HongKong and #Singapore as #coronavirus ...   #Qantas #flights from #Sydney to #Shanghai will remain #suspended until at least the end of May as the coronavirus claims more lives.  https://t.co/SDgxHEkH10 via @MailOnline",alba_dalai,"['China', 'HongKong', 'Singapore', 'coronavirus', 'Qantas', 'flights', 'Sydney', 'Shanghai', 'suspended']",14112
2020-02-20 00:14:40,"@PeterSchiff @CNBCFastMoney What I can’t believe is @agnicoeagle huge drop and management never addressed it. Also, with gold prices going up, #coronavirus, one would think $AEM should have strongly rebounded back. #cnbc #hongkong #HKEX #gold",herdfightsback,"['coronavirus', 'cnbc', 'hongkong', 'HKEX', 'gold']",6
2020-02-20 00:02:14,#Coronavirus causes postponement of #HongKong Sports Stars Awards https://t.co/bDYfe76USI,insidethegames,"['Coronavirus', 'HongKong']",29377
2020-02-20 00:00:00,Grim data from global shipping in wake of #coronavirus • #HongKong port activity drops sharply • #Singapore absorbing some of Hong Kong’s losses on shipping front • #LosAngeles port activity at lowest level since height of US-China trade war (via @economics) https://t.co/B3fdPSHM6G,AgatheDemarais,"['coronavirus', 'HongKong', 'Singapore', 'LosAngeles']",2478
2020-02-19 23:53:31,"#HKSAR #CHICOM #ReginaIp's #coronavirus dog &amp; pony show sounds as ""legit"" as when BJ had #CCP #unitedfront connected taxi associations in #HongKong file 4 court injuctions during #Umbrella and 2 purge pro-#democracy lawmakers from the #LegCo. https://t.co/aN6lSzmUF4",DanGarrett97,"['HKSAR', 'CHICOM', 'ReginaIp', 'coronavirus', 'CCP', 'unitedfront', 'HongKong', 'Umbrella', 'democracy', 'LegCo']",5683
2020-02-19 23:50:27,We really need the healthy people in #PRC to firecracker the Communist Party in #China.  Because the world has had enough.  #FreeHongKong #HongKong #Taiwan #Tibet #FreeTibet #Xinjiang #Wuhan #Coronavirus #COVID19 #Huawei https://t.co/EjRGDf5uBJ,lucas_and_mew,"['PRC', 'China', 'FreeHongKong', 'HongKong', 'Taiwan', 'Tibet', 'FreeTibet', 'Xinjiang', 'Wuhan', 'Coronavirus', 'COVID19', 'Huawei']",96
2020-02-19 23:45:13,"Some #HongKong passengers onboard #DiamondPrincess cruise are eager to get on the charter flight; some contracted the #Coronavirus are now isolated in #Japan’s hospital, worrying their families who left onboard the ship.  #COVID #COVID19 #China #wuhan #冠状病毒 #coronavirus",Mina32134295,"['HongKong', 'DiamondPrincess', 'Coronavirus', 'Japan', 'COVID', 'COVID19', 'China', 'wuhan', '冠状病毒', 'coronavirus']",501
2020-02-19 23:37:20,.@BorisJohnson listen.  You are a racist for relying on #Huawei for #5G in the UK.  What the fuck happened to #Nokia and #Ericsson?!  #BorisTheRacist #China #Wuhan #HongKong #FreeHongKong #WuhanCoronavius #COVID19 #coronavirus #ncov19 #Tibet #Xinjiang #Taiwan https://t.co/dLzRzOf4KG,lucas_and_mew,"['Huawei', '5G', 'Nokia', 'Ericsson', 'BorisTheRacist', 'China', 'Wuhan', 'HongKong', 'FreeHongKong', 'WuhanCoronavius', 'COVID19', 'coronavirus', 'ncov19', 'Tibet', 'Xinjiang', 'Taiwan']",96
2020-02-19 23:32:49,#Coronavirus: #HongKong #tourismsector taking ‘bigger hit’ than during #Sars https://t.co/R9OYog6b8z | via @scmpnews by @Denise_Tsang,IvanhoeMd,"['Coronavirus', 'HongKong', 'tourismsector', 'Sars']",449
2020-02-19 23:31:40,#Coronavirus: massive HK$30 billion relief package revealed as #HongKong government plans to bail out struggling industries and fund the fight against deadly bug https://t.co/6NJ7Hn4vmr https://t.co/QJEhXkuUPm,BienPerez,"['Coronavirus', 'HongKong']",1219
2020-02-19 23:30:57,"Meanwhile, 102 #HongKong passengers onboard #DiamondPrincess arrived #HanedaAirport in #Tokyo, they took the govt-chartered flight with 8 health officials back home.  #COVID #COVID19 #China #wuhan #冠状病毒 #coronavirus #CoronavirusOutbreak #Wuhan #coronaviruschina",Mina32134295,"['HongKong', 'DiamondPrincess', 'HanedaAirport', 'Tokyo', 'COVID', 'COVID19', 'China', 'wuhan', '冠状病毒', 'coronavirus', 'CoronavirusOutbreak', 'Wuhan', 'coronaviruschina']",501
2020-02-19 23:30:13,#Coronavirus: #HongKong's citizens are getting angry as their borders remain open — Sky News https://t.co/8y6nvRV57v #TechJunkieNews https://t.co/6jKrw5WfQa,techjunkiejh,"['Coronavirus', 'HongKong', 'TechJunkieNews']",28956
2020-02-19 23:04:27,"Three more confirmed #Coronavirus cases added to #HongKong, bringing the total 65.  Official reported the 2nd death of the virus yesterday, the 70-yr-old male remained in critical condition after hospitalised.   @rthk_news #香港武肺確診增至共65宗 https://t.co/VWFKCnwBJQ",nikki_miumiu,"['Coronavirus', 'HongKong', '香港武肺確診增至共65宗']",9774
2020-02-19 22:56:02,"#China moves more #Ovens into #Auschwitz, er...#Wuhan as #Political purge continues under cover of #Coronavirus that they created and released to stop #HongKong #Freedom from spreading: https://t.co/wPbtTajvfR",RadioFarSide,"['China', 'Ovens', 'Auschwitz', 'Wuhan', 'Political', 'Coronavirus', 'HongKong', 'Freedom']",602
2020-02-19 22:36:09,"On today's Money Talk; The #HongKong government will launch a special HK$30 bln relief fund. The funds will be used to provide one-off cash injections to industries hit hard by the #coronavirus such as retail, leisure &amp; tourism &amp; to fight the spread of the #Covid-19 virus. 1/12",MoneyTalkRadio3,"['HongKong', 'coronavirus', 'Covid']",198
2020-02-19 22:32:39,"On today's Money Talk; The #HongKong government will launch a special HK$30 bln relief fund. The funds will be used to provide one-off cash injections to industries hit hard by the #coronavirus such as retail, leisure &amp; tourism &amp; to fight the spread of the #Covid-19 virus.  1/12",MoneyTalkR3,"['HongKong', 'coronavirus', 'Covid']",1231
2020-02-19 22:31:41,#CDC Issues #HongKong Travel Advisory; #Dems Demand Trump Reimburse States Battling #Coronavirus https://t.co/LiO8yHUoOf,michaelallenmar,"['CDC', 'HongKong', 'Dems', 'Coronavirus']",17267
2020-02-19 22:23:19,Very serious tweet #COVID19 #SARSCoV2 #deaths #coronavirus #outbreak #Wuhan #coverup #China #pandemic #USA #Australia #UK #Japan #Singapore #California #Texas #Georgia #NYC #Florida #Hawaii #Chicago #HongKong #2019nCoV #Russia #Wisconsin #Hawaii #Taiwan #CDC #US #military #NYC https://t.co/0jNLgaI0mO,nCoVSurviving,"['COVID19', 'SARSCoV2', 'deaths', 'coronavirus', 'outbreak', 'Wuhan', 'coverup', 'China', 'pandemic', 'USA', 'Australia', 'UK', 'Japan', 'Singapore', 'California', 'Texas', 'Georgia', 'NYC', 'Florida', 'Hawaii', 'Chicago', 'HongKong', '2019nCoV', 'Russia', 'Wisconsin', 'Hawaii', 'Taiwan', 'CDC', 'US', 'military', 'NYC']",380
2020-02-19 22:20:09,#CDC Issues #HongKong Travel Advisory; Dems Demand #Trump Reimburse States Battling Coronavirus  https://t.co/YGaFGcqNYn  #BreakingNews #Coronavirus #CoronavirusOutbreak #China #Collapse #COVID19 #USA,SecretNews,"['CDC', 'HongKong', 'Trump', 'BreakingNews', 'Coronavirus', 'CoronavirusOutbreak', 'China', 'Collapse', 'COVID19', 'USA']",1390
2020-02-19 22:00:43,Nearly 80% of #HongKong citizens believe the economy is getting worse due to on-going #protests and the #coronavirus according to a new @GallupPoll.  https://t.co/74sp2tcykj @antgrasso #ArtificialIntelligence #IoT #IoE @MikeQuindazzi HT @StatistaCharts https://t.co/WIQXQs6MFa,AnnetteSophonie,"['HongKong', 'protests', 'coronavirus', 'ArtificialIntelligence', 'IoT', 'IoE']",667
2020-02-19 21:40:48,"I’m afraid for this woman’s life. She has publicly released a video where she supports the independence of #Taiwan and #HongKong, criticized the #CCP for its handling of the #coronavirus. She is truly brave but the dark reality is that people who do this end up tortured to death. https://t.co/yEKZlBv6M5",EUPolitique,"['Taiwan', 'HongKong', 'CCP', 'coronavirus']",16
2020-02-19 21:40:05,#Coronavirus updates: WaPo - #Iran reports two coronavirus deaths - The Washington Post #CDC Issues Level 1 Threat for #HongKong travelers &amp; 25 Senators request additional funds from Trump to fight #CoronavirusOutbreak #covid #covid19 https://t.co/Ma9uB7RSpd,Beaubier,"['Coronavirus', 'Iran', 'CDC', 'HongKong', 'CoronavirusOutbreak', 'covid', 'covid19']",1426
2020-02-19 21:34:57,"@CDCgov issued travel guidelines for #HongKong after 2nd #Coronavirus-related death in the city. It is the CDC's lowest-level travel warning, but it’s the first coronavirus-related travel notice issued by the #US govt for a territory beyond China.  #美疾控中心首對香港發旅遊警告 https://t.co/eXqYoTnttG https://t.co/WsDpHuojJ6",nikki_miumiu,"['HongKong', 'Coronavirus', 'US', '美疾控中心首對香港發旅遊警告']",9774
2020-02-19 21:34:54,Ranked by Steep Climb Rate or Most Recent-Highest Standard Deviation:  #1 #SouthKorea #2 #Japan #3 #Singapore #4 #HongKong  #COVID19 #coronavirus,BostonRoca,"['SouthKorea', 'Japan', 'Singapore', 'HongKong', 'COVID19', 'coronavirus']",1213
2020-02-19 21:31:37,#hongkong doesn't generate the #coronavirus but all new confirmed cases are imported from travellers to and from China. And unfortunately the border is slowly opening again. Please pray for #HK to get through this. #wuhancoronavirus https://t.co/MZaUSobzKp,miss852hk,"['hongkong', 'coronavirus', 'HK', 'wuhancoronavirus']",231
2020-02-19 21:29:19,CDC issues 'Level 1' warning for travel to #HongKong  #COVID2019 #coronavirus  https://t.co/Yg4pVVsi5e,Apex_WW,"['HongKong', 'COVID2019', 'coronavirus']",2124
2020-02-19 21:27:04,@CrushTheStreet #Coronavirus #Covid19 #SARS 2.0 - #CDC issues travel guidelines for #HongKong after second coronavirus-related death in the city https://t.co/51Lyq7PaCD,TraderStef,"['Coronavirus', 'Covid19', 'SARS', 'CDC', 'HongKong']",5973
2020-02-19 21:11:03,CDC issues travel guidelines for #HongKong due to #coronavirus: CNBC https://t.co/iEj8OxfJD1 #HumanRights  MORE w/ EcoSearch - news: https://t.co/3REZhAiFTo web: https://t.co/WOlTT7EiVQ,EcoInternetDrGB,"['HongKong', 'coronavirus', 'HumanRights']",34576
2020-02-19 21:00:01,Hong Kong reports second coronavirus death as it draws plans to fly stranded residents back from virus-stricken cruise ship in Japan...  #HongKong #Coronavirus #China #Wuhan #COVID19 #CoronavirusOutbreak https://t.co/4z3iov2ql3,TPE_connect,"['HongKong', 'Coronavirus', 'China', 'Wuhan', 'COVID19', 'CoronavirusOutbreak']",617
2020-02-19 20:38:23,#cathaypacific flight #cx8543 departing from #hnd #haneda #japan bound for #hkg #hongkong has left carrying #diamondprinces Hong Kong citizens home. They will be subject to another 14 days of quarantine #wuhancorinavirus #coronavirus ⁦@flightradar24⁩ ⁦@flightaware⁩ https://t.co/lgI0glxAKZ,manucanuck,"['cathaypacific', 'cx8543', 'hnd', 'haneda', 'japan', 'hkg', 'hongkong', 'diamondprinces', 'wuhancorinavirus', 'coronavirus']",556
2020-02-19 20:13:45,#RUSSIA BANS ENTRY OF #HONGKONG AND #MACAU RESIDENTS. #CORONAVIRUS #COVID19,oli3be,"['RUSSIA', 'HONGKONG', 'MACAU', 'CORONAVIRUS', 'COVID19']",659
2020-02-19 20:00:00,Nearly 80% of #HongKong citizens believe the economy is getting worse due to on-going #protests and the #coronavirus according to a new @GallupPoll.  https://t.co/JPUmAcEE8m https://t.co/C6yaC1qlDE,StatistaCharts,"['HongKong', 'protests', 'coronavirus']",63173
2020-02-19 19:48:33,Today #HongKong confirms the second #coronavirus fatality,raquelpearljam,"['HongKong', 'coronavirus']",693
2020-02-19 19:41:13,#Breaking: CDC issues travel guidelines for #HongKong after second #coronavirus-related death in the city https://t.co/x0z0B9qYpc https://t.co/MnYB61AIk7,News247WorldPre,"['Breaking', 'HongKong', 'coronavirus']",630
2020-02-19 19:37:56,#CDC issues travel guidelines for #HongKong after second #coronavirus-related death in the city-CNBC,sellvolbuytesla,"['CDC', 'HongKong', 'coronavirus']",32
2020-02-19 19:13:52,#coronavirus The US Centers for Disease Control and Prevention issued a new travel advisory today for Hong Kong due to the coronavirus outbreak. #infectiousdisease #covid19 #pandemic #tourism #Quarantine #traveladvisory #hongkong #travelalert,MusafirNamah,"['coronavirus', 'infectiousdisease', 'covid19', 'pandemic', 'tourism', 'Quarantine', 'traveladvisory', 'hongkong', 'travelalert']",3023
2020-02-19 18:56:27,#Coronavirus: confirmed #HongKong cases now 65 as mother-in-law of infected engineer becomes one of three more struck down in #CoronavirusOutbreak | South China Morning Post #epidemiology #COVID19 #2019nCoV #publichealth  https://t.co/z0Ol2mFr44,davi326,"['Coronavirus', 'HongKong', 'CoronavirusOutbreak', 'epidemiology', 'COVID19', '2019nCoV', 'publichealth']",2743
2020-02-19 18:45:21,"United has suspended flights between U.S. &amp; Beijing, Chengdu, Hong Kong and Shanghai, until April 24. The airline has also suspended ticket sales for MileagePlus Award travel &amp; flights between U.S.&amp;China on partner airlines #CoronaVirus⚠️#HongKong (63 total),Japan 84, Singapore84",elitepro,"['CoronaVirus', 'HongKong']",24989
2020-02-19 18:07:37,The US Centers for #Disease Control and Prevention issued a new travel advisory today for #HongKong due to the #coronavirus outbreak. #China #Asia #COVID19 #CDC https://t.co/g4gtmOmFbg,Super_Said,"['Disease', 'HongKong', 'coronavirus', 'China', 'Asia', 'COVID19', 'CDC']",10125
2020-02-19 17:30:00,"Dozens of #HongKong doctors remained in #Shenzhen, Guangdong province to care for patients and fight the outbreak of the novel #coronavirus.",ChinaDaily,"['HongKong', 'Shenzhen', 'coronavirus']",4286374
2020-02-19 17:20:52,"Expats Flee #HongKong Over Protests, #Coronavirus  https://t.co/7g0GbvTPc3",SecretNews,"['HongKong', 'Coronavirus']",1390
2020-02-19 17:19:48,@JOceanW It indicates a frame-up of medical staff who went on strike. #HKGov is consistently putting blame on #Hongkongprotest to cover up its shortcomings towards #Hongkong people.  #StandwithHK #followbackhongkong #FightForFreedom @Michael_Yon #COVID19 @rachelblundy #coronavirus,h3avyarm5,"['HKGov', 'Hongkongprotest', 'Hongkong', 'StandwithHK', 'followbackhongkong', 'FightForFreedom', 'COVID19', 'coronavirus']",19
2020-02-19 17:15:09,#BREAKING CDC issues a Level 1 travel warning for #HongKong re #coronavirus,newsfreak1984,"['BREAKING', 'HongKong', 'coronavirus']",558
2020-02-19 17:06:58,#HKGov is literally exerting every effort to 'babysit' #China mainlanders while disregarding the health and safety of #Hongkong people.  #StandwithHK #Hongkongprotest #followbackhongkong #COVID19 #coronavirus #FightForFreedom @HongKongFP @Michael_Yon @JooeySiiu @matanevenoff https://t.co/NuMim7nROv,h3avyarm5,"['HKGov', 'China', 'Hongkong', 'StandwithHK', 'Hongkongprotest', 'followbackhongkong', 'COVID19', 'coronavirus', 'FightForFreedom']",19
2020-02-19 17:05:03,"A 70-year-old man in #HongKong has died of the #Coronavirus on Wednesday morning, bringing the total number of #COVID19-linked deaths in the city to 2.  His death is the 6th COVID-19-related death outside of mainland #China. https://t.co/Z4vH94InGR",EpochTimesChina,"['HongKong', 'Coronavirus', 'COVID19', 'China']",21498
2020-02-19 17:00:01,Hong Kong reports second coronavirus death as it draws plans to fly stranded residents back from virus-stricken cruise ship in Japan..  #HongKong #Coronavirus #China #Wuhan #COVID19 #CoronavirusOutbreak https://t.co/4z3iouKOWt,TPE_connect,"['HongKong', 'Coronavirus', 'China', 'Wuhan', 'COVID19', 'CoronavirusOutbreak']",617
2020-02-19 16:59:14,Massive HK$30 billion #economic relief package revealed as #HongKong fights back https://t.co/LBjXO3Uw2i via @scmpnews #economy #retail #food #drink #transport #arts #tourism #COVID19 #coronavirusoutbreak #China #210nCoV #coronavirus @hk_jessicak @stephanie_hk @investHK_ldn,davi326,"['economic', 'HongKong', 'economy', 'retail', 'food', 'drink', 'transport', 'arts', 'tourism', 'COVID19', 'coronavirusoutbreak', 'China', '210nCoV', 'coronavirus']",2743
2020-02-19 16:51:38,"Millions in #China, #Singapore &amp; #HongKong are staying home Due to the #Coronavirus. The world’s largest work from home policy never seen before could trigger how we do business in the future. Click on the link below to read our latest article.  https://t.co/pL7PAoeoAQ  #crypto",cryptotask_2017,"['China', 'Singapore', 'HongKong', 'Coronavirus', 'crypto']",1406
2020-02-19 16:38:13,"#HospitalAuthority displaying the same #CCP #logic that allowed #coronavirus/#covid19/#WARS to spread wild in #Wuhan and #CarrieLam did in refusing to close #HongKong's borders w/ #China. Aside fm asymptomatic cases, but the time symptoms appear its too late ... smh https://t.co/tq6o59LZu6",DanGarrett97,"['HospitalAuthority', 'CCP', 'logic', 'coronavirus', 'covid19', 'WARS', 'Wuhan', 'CarrieLam', 'HongKong', 'China']",5683
2020-02-19 16:23:31,"Pure #Xiwinger #HKSAR #CCP #coronavirus/#COVID19/#WARS peformance theater by Transport chief: Scrub all u want but as soon as an infected person touches a ""disinfected area"" its contaminated. Hmm, in ~20 yrs in #HongKong the ONLY people I saw playing w/ a #taxi hood were drivers. https://t.co/I2Xo94C70y",DanGarrett97,"['Xiwinger', 'HKSAR', 'CCP', 'coronavirus', 'COVID19', 'WARS', 'HongKong', 'taxi']",5683
