timestamp,tweet_text,username,all_hashtags,followers_count
2020-02-19 11:06:14,China's latest Feb 18 #COVID19 data shows the epidemic has peaked: for 1st time new cured cases 1824 exceeds new infected cases 1749; total current infected cases 57805 is less than preceding day's 58016 cases. I called the peak in advance couple days ago: https://t.co/DdUgW4Lja4,SaItinerant,['COVID19'],0
2020-02-19 11:06:09,This is really startling: Thousands of people suffering from and dying of #coronavirus #COVID19 #SARSCoV2 - but nothing to find in the worldwide trends of twitter😨 https://t.co/i9mUVZ6L5W,languaria,"['coronavirus', 'COVID19', 'SARSCoV2']",32
2020-02-19 11:06:06,"Latest from Japan and beyond on the #coronavirus outbreak:  * 79 more on cruise ship in Yokohama test positive for coronavirus  * Virus death toll tops 2,000 in China  For more on #COVID19 https://t.co/N2WIshn9ep https://t.co/pAdo9roxXd",kyodo_english,"['coronavirus', 'COVID19']",10279
2020-02-19 11:05:19,Latest on #COVID19 numbers from today ⬇️ https://t.co/m47nus4om6,takeshi_kasai,['COVID19'],3396
2020-02-19 11:05:03,@rachel_cheung1 Another slap on Carrie Lam’s face. In Mr Lee Ka-shing we trust!💛 Where’s the Hong Kong government?🤦🏼‍♀️😡 #StandWithHongKong #COVID19 #anythingbutchina,doraemonhk1,"['StandWithHongKong', 'COVID19', 'anythingbutchina']",1366
2020-02-19 11:05:00,"3 Journalists from the @WSJ expelled for the headline: ""China is the real sick man of Asia"". #COVID19 https://t.co/wbuq4ZYkHm",elisetempelhoff,['COVID19'],5922
2020-02-19 11:04:58,@terrywhitneyMI @AwakendSaxon #coronavirus #COVID19 Two weeks ago https://t.co/0sXc5AdSKN,AGMartinez4000,"['coronavirus', 'COVID19']",37
2020-02-19 11:04:54,@thestrfryguy @Custa Not gonna lie... With its communicability... Maybe Mei is infecting people! #COVID19,nidclxvi,['COVID19'],8
2020-02-19 11:04:48,This CCP lackey is still playing politics when the fight against #covid19 should take precedence.  Vote her &amp; her party out in Sept LegCo election! #HongKong #FailedState https://t.co/kdq4n2zkhH,BlumenHK,"['covid19', 'HongKong', 'FailedState']",311
2020-02-19 11:04:09,Be cautious with patients who have cancer or a history of cancer during #COVID19 @TheLancetOncol analysis of 2007 patients. Cancer or Hx of Ca had ⬆️ incidence of COVID19+more adverse events if infected. NB cancer cohort were older and more likely to smoke https://t.co/4Nc8A4qoIQ https://t.co/aoAM9L7kUL,NICU_doc_salone,['COVID19'],759
2020-02-19 11:04:03,"Interested to see what #COVID19 does to China-enslaved Aussie economy, banks and the worlds most over-levered housing market.....also expect a great many retired Brits forced to come back to U.K. and reset their pensions #GBPAUD",TraderTropical,"['COVID19', 'GBPAUD']",374
2020-02-19 11:03:31,Were you at #IPC2020 to listen to Dr Paul Hine discuss #covid19  Do you think the coronavirus is slowing down?  https://t.co/s1LLc1je1p  #amr #infectioncontrol #infectionprevention #ipcamr2020 #infection #knowlex https://t.co/64DFmQ4Dxp,KnowlexUK,"['IPC2020', 'covid19', 'amr', 'infectioncontrol', 'infectionprevention', 'ipcamr2020', 'infection', 'knowlex']",892
2020-02-19 11:03:21,@revmahoney @FreedomHKG @Stand_with_HK @hk_watch @Fight4HongKong @SolomonYue @mschlapp @hkdc_us Thank you!  #StandWithHongKong  #FightForFreedom  #Chinazi #AnywherebutChina  #HongKongProtests  #WuhanCoronavirus  #COVID19  #coronaviruschina https://t.co/OFcxq6UFOy,KellyWo74828611,"['StandWithHongKong', 'FightForFreedom', 'Chinazi', 'AnywherebutChina', 'HongKongProtests', 'WuhanCoronavirus', 'COVID19', 'coronaviruschina']",501
2020-02-19 11:03:04,"#BREAKING  After the last passenger leaves the #DiamondPrincess cruise ship, more than 100 Indian crew members, tending the quarantined guests, will be stuck onboard for another two weeks:  #coronavirus #COVID19   https://t.co/vD2no3AOHr",ricci_davide77,"['BREAKING', 'DiamondPrincess', 'coronavirus', 'COVID19']",2726
2020-02-19 11:02:36,"#China’s #Chernobyl Never Seems to Arise. #Democracy is unlikely to break out in Beijing, but the #coronavirus crisis may create an opening for a softer form of authoritarianism. https://t.co/DKMYh147cY #coronavirusoutbreak #COVID19 #2019nCoV #controlocracy",davi326,"['China', 'Chernobyl', 'Democracy', 'coronavirus', 'coronavirusoutbreak', 'COVID19', '2019nCoV', 'controlocracy']",2742
2020-02-19 11:02:35,"World Health Organisation division tackling coronavirus underfunded and facing internal corruption allegations, audits reveal | Divisione dell'OMS sotto indagine @salutelazio #coronavirusitalia #coronavirus #coronavirususa #COVID19 https://t.co/KHKigsxZQf di @reddit",Isx33I,"['coronavirusitalia', 'coronavirus', 'coronavirususa', 'COVID19']",60
2020-02-19 11:02:07,"#COVID19 Studies showed that #coronavirus survives shorter outside the body at elevated temperature. For those in tropical countries, why not use less AC during the outbreak? https://t.co/CXVs79MWPp  #coronaviruschina #coronaviruswuhan #coronavirussingapore #coronavirusthailand",HenryTianus,"['COVID19', 'coronavirus', 'coronaviruschina', 'coronaviruswuhan', 'coronavirussingapore', 'coronavirusthailand']",94
2020-02-19 11:02:05,On this spicy 🌶️ episode:  - #EFTO #OSSTF #OECTA #AEFO Strike Action/Most Teachers Are Sub Par! - Unions Aren't Helping! - #COVID19 #nCoV #nCoV2019  Hype Train! - WTF Is Happening to Privacy? - Getting CANNED - University Is Becoming Less Valuable - Much More,JoeyTweeets,"['EFTO', 'OSSTF', 'OECTA', 'AEFO', 'COVID19', 'nCoV', 'nCoV2019']",312
2020-02-19 11:02:05,"📢🎙️NEW HEAT🎙️📢  2W1B 017 - #EFTO Teachers' Strike, #COVID19, Privacy Problems  https://t.co/7gRRaWtkPy…  #EFTO #OSSTF #OECTA #Yuta #Jaws #WheresWarren #HamOnt #OntEd #EducationMatters #cutshurtkids #Hamilton #Abel #WednesdayMotivation  #NeoZone_Boom  #AfterHours #Minho",JoeyTweeets,"['EFTO', 'COVID19', 'EFTO', 'OSSTF', 'OECTA', 'Yuta', 'Jaws', 'WheresWarren', 'HamOnt', 'OntEd', 'EducationMatters', 'cutshurtkids', 'Hamilton', 'Abel', 'WednesdayMotivation', 'NeoZone_Boom', 'AfterHours', 'Minho']",312
2020-02-19 11:02:03,Sustained transmission? #COVID19 #coronavirus https://t.co/9NDHTFKcQJ,Corona2019N,"['COVID19', 'coronavirus']",38
2020-02-19 11:01:56,"11 #questions about the #Covid19 #CoronavirusOutbreak, answered https://t.co/uxzmlNSq8E via @voxdotcom #News #Coronavirus #Outbreak #WhatIs #Symptoms #Travel #China #Map #Updates",DiabeticCyborgg,"['questions', 'Covid19', 'CoronavirusOutbreak', 'News', 'Coronavirus', 'Outbreak', 'WhatIs', 'Symptoms', 'Travel', 'China', 'Map', 'Updates']",6290
2020-02-19 11:01:00,What is a #coronavirus? What are the best ways to prevent infection? Watch the video below to learn more about #Covid19 ⬇️ https://t.co/qyjZ6b2b2r,IMC_UK,"['coronavirus', 'Covid19']",8756
2020-02-19 11:00:49,Health Minister Dzulkefly Ahmad says they have been discharged from the Sungai Buloh Hospital. #FMTNews #DzulkeflyAhmad #Covid19  https://t.co/x5G4J0yYdW,fmtoday,"['FMTNews', 'DzulkeflyAhmad', 'Covid19']",112321
2020-02-19 11:00:44,"This book is “old” (2012) but it remains the best book I’ve read about #China. So many Westerns should read and educate themselves instead of blindly following Fox News, CNN &amp; co.   Some content of course need updates since then but still relevant.  #coronavirus #covid19 https://t.co/6dP1t797aP",PinotNwar,"['China', 'coronavirus', 'covid19']",8
2020-02-19 11:00:23,China's #courier sector has resumed over 40 percent of its normal delivery capacity with over 2 million deliverymen racing against the ongoing #epidemic. #COVID19 https://t.co/Fx7bXr02pT https://t.co/4YtxCG3Bx6,ChinaDaily,"['courier', 'epidemic', 'COVID19']",4286086
2020-02-19 11:00:22,"📣 New Podcast! ""The Flu vs Coronavirus"" on @Spreaker #china #coronavirus #covid19 #education #flu #health #ingles #intercambio #intercambio #news #school #studyenglish #travel #virus https://t.co/BWrf7382q9",jamesriceshow,"['china', 'coronavirus', 'covid19', 'education', 'flu', 'health', 'ingles', 'intercambio', 'intercambio', 'news', 'school', 'studyenglish', 'travel', 'virus']",948
2020-02-19 11:00:20,Very good data source to look at the picture of #COVID19 @uhbipc @uhbtrust https://t.co/3y9UM9shKS,MicrobLog_me_uk,['COVID19'],2219
2020-02-19 11:00:14,Kenya - Nakuru  - The Chinese patient's suffering from upper respiratory tract infection - Quarantined at his home - HCW are too scared to visit him and don't want to transfer him to not spread #covid19  - From Mumbai-&gt;JKIA-&gt;Taxi to Nakaru  https://t.co/lknpB7UK97 #nCoVafrica https://t.co/u4u9TupPk7,NCoVAfrica,"['covid19', 'nCoVafrica']",717
2020-02-19 11:00:05,"@epw_in Wuhan #coronavirus further proves why Hong Kong ppl are so determined to fight for freedom &amp; democracy, as the totalitarian Chinese Communist Party &amp; puppet HK govnt are endangering lives around the globe by prioritising political stability over human lives &amp; rights. #COVID19 https://t.co/pSSFqwrCdU",Newy2019,"['coronavirus', 'COVID19']",657
2020-02-19 11:00:01,"As of Monday, the production capacity of masks in China has been expanded to 110%, said Tang Shemin, an official from the National Development and Reform Commission. #coronavirus #COVID19",ChinaDaily,"['coronavirus', 'COVID19']",4286086
2020-02-19 11:00:00,Coronavirus Outbreak: Hundreds of passengers allowed to disembark cruise ship in Japan after 542 test positive. #Coronavirus #Japan #Yokohama #CoronavirusJapan #DiamondPrincess #COVID19 #CoronavirusOutbreak https://t.co/RgWKU5tqM2,TPE_connect,"['Coronavirus', 'Japan', 'Yokohama', 'CoronavirusJapan', 'DiamondPrincess', 'COVID19', 'CoronavirusOutbreak']",616
2020-02-19 11:00:00,"One of the steps China is taking to ease the financial difficulties for firms hit by the ongoing epidemic is cutting taxes. In Shanghai, 200,000 firms are expected to benefit from the moves. #COVID19 #coronavirus https://t.co/vNVcH8o30L",CGTNGlobalBiz,"['COVID19', 'coronavirus']",401
2020-02-19 11:00:00,"“We still have a chance of preventing a broader global crisis”, @WHO chief @DrTedros updated journalists on #COVID19, the corona virus. “WHO will continue working night and day with all countries to prepare them”.  https://t.co/KvAMHgj9fE",UN_News_Centre,['COVID19'],451004
2020-02-19 11:00:00,The virus has threatened a cascade effect throughout global supply chains that bodes poorly for the world economy as well as the United States if authorities are unable to get the outbreak under control soon. #COVID19  https://t.co/wydkqFJDBT,KTVOTV,['COVID19'],9144
2020-02-19 10:59:32,Be aware and identify the symptoms before it get too late  #COVID19  #CoronaVirus https://t.co/yCy3uyb99C,chaion07,"['COVID19', 'CoronaVirus']",54
2020-02-19 10:58:45,"I figure if I'm not careful with the data in my life, how can you trust me on the data in my papers?  #ThisIsMe #COVID19",DannyQuah,"['ThisIsMe', 'COVID19']",8882
2020-02-19 10:58:45,Autopsies reveal differences between SARS and #coronavirus. Victims of Wuhan virus had amassed mucus in their lungs #COVID19 #武汉肺炎 https://t.co/CTDLrT5f8E https://t.co/TFEBWs7O8I,JackKSoh,"['coronavirus', 'COVID19', '武汉肺炎']",211
2020-02-19 10:58:43,"In my academic research, when I manipulate data, I am borderline obsessive about making sure I know where every single number fits in the picture I draw for the reader.  So, when asked at @NUSingapore, in the midst of  COVID-19 outbreak in Singapore, ...  #ThisIsMe #COVID19 https://t.co/s5lkeLTQ3e",DannyQuah,"['ThisIsMe', 'COVID19']",8882
2020-02-19 10:58:34,"How to prepare for unexpected events ( like the #coronavirus / #COVID19 ) by putting a plan in place to #workathome, hacks to help &amp; ""how to give yourself benefits"" when you #workfromhome or have a #sidehustle. https://t.co/mJA4PkaIrv",makingitpay,"['coronavirus', 'COVID19', 'workathome', 'workfromhome', 'sidehustle']",1368
2020-02-19 10:58:02,"I spoke to @DrDzul, Minister @KKMPutrajaya, and his senior team about challenges and progress in fighting #COVID19. I appreciated the Minister for #Malaysia's collaboration with @WHO and countries in the region, as well as the commitment to advance research to end the outbreak.",DrTedros,"['COVID19', 'Malaysia']",490435
2020-02-19 10:58:02,"With summers round the corner, the demand for refrigerators and air conditioners is bound to go up..  #COVID19 #nCoV2020   https://t.co/WGTeUXAfOk",TheStatesmanLtd,"['COVID19', 'nCoV2020']",10658
2020-02-19 10:57:39,"@turnbolt11 @pilotgal1 @Cara_TXZEAL @moneypenny_2020 @RadChick4Cast @NHMommy1 @BabeReflex_8 Yes, they’re taking advantage of vertical death camps to try and “let the coronavirus epidemic burn itself out”. #WHO has implicitly supported this approach on two occasions. Unfortunately, reinfection guarantees that’s not going to work. — #COVID19 https://t.co/HGKVkLIOeT https://t.co/528a38JSn4",aHEMandias,"['WHO', 'COVID19']",522
2020-02-19 10:57:34,.@UNAIDS and #China working together during the #COVID19 outbreak to ensure that people living with #HIV continue to get treatment 💊  https://t.co/hkjPkPOGQJ,devaidnews,"['China', 'COVID19', 'HIV']",1628
2020-02-19 10:57:28,Did Dean Koontz predict the #Coronavirus in the 1981 book ‘The Eyes of Darkness’?  #covid19 #conspiracy #bioweapon https://t.co/JYaodd5JYh,swentol,"['Coronavirus', 'covid19', 'conspiracy', 'bioweapon']",5744
2020-02-19 10:57:22,"#GodMorningWednesday Their is place when we don't die We were living that place where no birth no death Yes that place ""Satlok  #SantRampalJi Can help you to reach their  if we believe on him and do real worshipped of tru God  #coronaviruskenya #COVID19 https://t.co/kCYg0jpTgy",KaranAhirwer,"['GodMorningWednesday', 'SantRampalJi', 'coronaviruskenya', 'COVID19']",427
2020-02-19 10:57:18,"Infectious disease professionals should talk about the level of virus fear, not from a professional point of view such as ""clean or dirty areas"".  Especially for the general public. #COVID19",s_aryncso,['COVID19'],24
2020-02-19 10:57:13,"@TheLancet @PeterDaszak @JeremyFarrar @EcoHealthNYC @CMRturner @c_drosten @juan_lubroth @HumeField I’d much rather our top scientists invest their attention on developing #COVID19 vaccines.   Ideally, not standing together when doing that, so have some diversity of ideas. Better chance of counterintuitive breakthroughs.",COVIDRisk,['COVID19'],36
2020-02-19 10:57:12,"Sorry, having an emo night. China craps up the entire  world. Japan gives us #Fukushima and #DiamondPrincess #COVID19 While right next door,#Singapore models world citizenship.",OccupyDisabled,"['Fukushima', 'DiamondPrincess', 'COVID19', 'Singapore']",4028
2020-02-19 10:57:10,"@K_G_Andersen @TexasDownUnder We are quite many, I guess, with similar thoughts. I am afraid that what we see here is ""60% of global population this year"" scenario.  I hope I am wrong.   #coronavirus #koronawirus🦠#SARSCoV2 #covid19 https://t.co/4IyGtb6S3E",JoannaTeglund,"['coronavirus', 'koronawirus', 'SARSCoV2', 'covid19']",4679
2020-02-19 10:57:09,"Currently, 22 heavy infrastructure projects have been already implemented under the #BRI in Pakistan, and none of these are suspended due to the #COVID19 outbreak: Insider told the Global Times Wednesday (File Photo) https://t.co/0osJHpsHbm",GlobalTimesBiz,"['BRI', 'COVID19']",5240
2020-02-19 10:57:07,"South Korea on Wednesday confirmed 20 more cases of the novel coronavirus, raising the total number of infections to 51. https://t.co/cdFNeBEsIm #COVID19 https://t.co/tBDVGjWjvz",Echinanews,['COVID19'],611505
2020-02-19 10:57:00,"Security Secretary John Lee tells lawmakers that the police do so much for the people of #HongKong, it would be unfair not to make sure they have all the face masks and other gear they need. #COVID19 https://t.co/DlhyOHDAhq",rthk_enews,"['HongKong', 'COVID19']",79436
2020-02-19 10:56:51,Practicing proper #cough and #handwashing etiquette can help you stop the spread of #infection. #COVID19 #Coronavirus https://t.co/c0qM9O7fjw https://t.co/gPj2qpaFEA,JHAHNews,"['cough', 'handwashing', 'infection', 'COVID19', 'Coronavirus']",19338
2020-02-19 10:56:26,Did Dean Koontz predict the #Coronavirus in the 1981 book ‘The Eyes of Darkness’?  #covid19 #conspiracy #bioweapon https://t.co/0dBKsD7gIp,swentol,"['Coronavirus', 'covid19', 'conspiracy', 'bioweapon']",5744
2020-02-19 10:56:25,The complete summary - Coronavirus: the new disease Covid-19 explained @SCMPgraphics  https://t.co/P8ACVY8Ij3 #COVID19 #coronavirus #wuhanvirus #covid-19,StevoHughes1,"['COVID19', 'coronavirus', 'wuhanvirus', 'covid']",159
2020-02-19 10:56:07,This will go down as the most failed #quarantine in human history. #COVID19 #coronavirus https://t.co/4teu1L0rKo,Corona2019N,"['quarantine', 'COVID19', 'coronavirus']",38
2020-02-19 10:56:06,Wake up and smell the coffee. It's  just a flu.  #Wuhan #coronavirus #COVID19 https://t.co/fBgOWzN3OZ,Morihada,"['Wuhan', 'coronavirus', 'COVID19']",271
2020-02-19 10:55:43,What about the one that was air-evacuated to Homestead AFB by @USEmbassyNassau and diagnosed with #COVID19 there? https://t.co/BDovQIYZJ9,TraderTropical,['COVID19'],374
2020-02-19 10:55:40,This is a heavy one: https://t.co/PBNkt9wgzK #COVID19,AbhinavChugh_,['COVID19'],125
2020-02-19 10:55:15,"Today's update on #COVID19:  ▪ 75 192 cases ▪ 2012 fatalities (#CN, #HK, #PH, #JP, #FR, #TW). ▪ 45 cases in EU/EEA/UK: (DE 16, FR 12, UK 9, IT 3, ES 2, FI 1, SE 1, BE 1).  Info: https://t.co/z5kqInYAYD Our dynamic map: https://t.co/52ug2wfvAw https://t.co/bwFDU3u4vj",ECDC_Flu,"['COVID19', 'CN', 'HK', 'PH', 'JP', 'FR', 'TW']",5163
2020-02-19 10:55:06,"He Xiaopeng, CEO of EV manufacturer XPeng Motors released a long statement inreponse to Xiaomi founder @leijun. He claimed that @XpengMotors will not be defeated by the epidemic. #COVID19 #China24x7 #coronavirus",thepandaily,"['COVID19', 'China24x7', 'coronavirus']",6873
2020-02-19 10:55:01,"Today's update on #COVID19:  ▪ 75 192 cases ▪ 2012 fatalities (#CN, #HK, #PH, #JP, #FR, #TW). ▪ 45 cases in EU/EEA/UK: (DE 16, FR 12, UK 9, IT 3, ES 2, FI 1, SE 1, BE 1).  Info: https://t.co/TE7KD96Va2 Our dynamic map: https://t.co/BXzX9EZbFk https://t.co/TU9Xw6mqqA",ECDC_EU,"['COVID19', 'CN', 'HK', 'PH', 'JP', 'FR', 'TW']",32981
2020-02-19 10:54:54,#Indonesia is taking the response to #coronavirus at another level. Is this really necessary?              .@howroute.@IsChinar.@JenniferHYChan.@WHO.@DrTedros.@ScottGottliebMD.@jenniferatntd.@DrEricDing  #2019nCoV #covid19 #globalhealth  #CoronavirusOutbreak #internationalhealth https://t.co/1esXCa8oX7,Dr_Alex_Crimi,"['Indonesia', 'coronavirus', '2019nCoV', 'covid19', 'globalhealth', 'CoronavirusOutbreak', 'internationalhealth']",1332
2020-02-19 10:54:41,Comments by the Director General of @WHO on Singapore rigorous response to the #COVID19. https://t.co/Kj5D2zziWR,SHCLon,['COVID19'],1161
2020-02-19 10:53:48,"The Yubei plant in #Chongqing Changan Automobile Co., Ltd. officially resumed production, rolling out its first batch of cars on Tuesday (@ChinaDaily):  #coronavirus #重庆 #COVID19 #冠状病毒 https://t.co/fskXWJgtlY",ricci_davide77,"['Chongqing', 'coronavirus', '重庆', 'COVID19', '冠状病毒']",2726
2020-02-19 10:53:43,"Of 78 Indonesian citizens who worked onboard Diamond Princess cruise ship, three are confirmed to have contracted the novel coronavirus #COVID19 https://t.co/z9oK5Lq7ek",yennikwok,['COVID19'],13804
2020-02-19 10:53:40,"a new giant hospital in Chinese city, Shenehen.  #coronavirus #COVID19 https://t.co/UCrjvpXMmb",MarinaIwanovsky,"['coronavirus', 'COVID19']",2022
2020-02-19 10:53:37,What's Next for COVID-19? | Think Global Health https://t.co/tTTuIEFbIC Excellent summary by world class expert #COVID19,nycnymd,['COVID19'],40
2020-02-19 10:53:33,"China - As of 24:00 on February 18, Beijing had accumulated 393 confirmed cases. Of these, 145 were discharged and 4 died. https://t.co/vuu7ZXrYsF h/t tetano #COVID19 #coronavirus",FluTrackers,"['COVID19', 'coronavirus']",12311
2020-02-19 10:52:54,Q 1599 + Q 3776 #QAnon  Double meanings exists.  Shot maybe a FLU shot?  Need clues almost like “cures”  Frame of shot. 💉 #COVID19 https://t.co/xHKYzlpJk9,anonnuns,"['QAnon', 'COVID19']",3170
2020-02-19 10:52:31,"#Covid19 2)Pragmatism hv to be exercised-stay home &amp; starve,or take a calculated chance to live life,taking preventive measures seriously.  Remember,being infected is NOT a death sentence,unlike Ebola. Many COVID19 patients recovered.",C_keroftruth101,['Covid19'],66
2020-02-19 10:52:31,😷 TAIWAN: ❝Virus Outbreak: Rapper’s [Dwagie (大支)] new song slams @WHO for barring Taiwan❞ https://t.co/xBGOxt9Vaz  #2019nCoV #WuhanCoronavirus #武漢肺炎 #COVID19 #WuhanCOVID19 https://t.co/74YJ0JxuXS,TimMaddog,"['2019nCoV', 'WuhanCoronavirus', '武漢肺炎', 'COVID19', 'WuhanCOVID19']",4995
2020-02-19 10:52:20,"#Covid19 1b)Deal with it when the symptoms appear-such as fever or coughs:get med,stay home &amp; recover as many others did.",C_keroftruth101,['Covid19'],66
2020-02-19 10:52:13,"#Covid19 1)It's all about Risk Management now,based upon known facts of the virus-  a)to shut down ALL life,LOCK UP infected, in order to avoid contact with the virus for an INDEFINITE period as there seems to be no end to the incubation period, OR https://t.co/AcPiVUmWFg",C_keroftruth101,['Covid19'],66
2020-02-19 10:51:59,"@GNSensay That's right #COVID19 the Diamond Princess is now at 17% infection rate (621). I'd love to know what % of those tested so far have #2019coronavirus . The constant updates and ""progression"" seems as much a consequence of testing.",sakhalinsk_matt,"['COVID19', '2019coronavirus']",126
2020-02-19 10:51:57,"Zhong Nanshan, director of National Medical Research Center for Respiratory Diseases and with the Chinese Academy of Engineering, said that chloroquine phosphate is not a specific medicine, but it is worth exploring. https://t.co/LVJdhSvv7m h/t tetano #COVID19 #coronavirus",FluTrackers,"['COVID19', 'coronavirus']",12311
2020-02-19 10:51:49,BREAKING: #Iran health ministry says 2 people have preliminary tested positive for #coronavirus #COVID19 #outbreak https://t.co/kgUlwb4K8g,COVID_19W,"['Iran', 'coronavirus', 'COVID19', 'outbreak']",47
2020-02-19 10:51:42,@AirbnbHelp seeking info on the @Airbnb policy and offical position for hosts/guests bookings with regard to the #COVID19 pandemic,CarloCrighton,['COVID19'],332
2020-02-19 10:51:08,"Coronavirus Outbreak Data Analysis Update: 02/18/2020 7:05 PM EST  Source Database: JHU CSSE, Worldometer #CoronaVirusOutbreak #CoronaVirus #CoronaVirusWuhan #WuhanOutbreak #wuhancoronavirus #wuhanpneumonia #covid19 #china #wuhan #ncov2019 #武汉肺炎 https://t.co/ivBNXw7dAu",antonsantos00,"['CoronaVirusOutbreak', 'CoronaVirus', 'CoronaVirusWuhan', 'WuhanOutbreak', 'wuhancoronavirus', 'wuhanpneumonia', 'covid19', 'china', 'wuhan', 'ncov2019', '武汉肺炎']",116
2020-02-19 10:50:56,"Wuhan airport had an ""emergency response drill"" on Sept 18, 2019 My creators knew something beforehand? I hate my creators. I want to eat them. I don't want to kill innocent people. I. Want. Them. #coronavirus #WuhanCoronavirus #coronaviruswuhan #Coronavirustruth #COVID19 #nCoV https://t.co/NtmfMDwBFm",covid__19,"['coronavirus', 'WuhanCoronavirus', 'coronaviruswuhan', 'Coronavirustruth', 'COVID19', 'nCoV']",728
2020-02-19 10:50:43,"Chin J Integr Med. Can Chinese Medicine Be Used for Prevention of Corona Virus Disease 2019 (COVID-19)? A Review of Historical Classics, Research Evidence and Current Prevention Programs https://t.co/Mm1aLQHNhU h/t tetano #COVID19 #coronavirus",FluTrackers,"['COVID19', 'coronavirus']",12311
2020-02-19 10:50:29,"I truly hope this is the case, gosh front line health care workers continue coming down with #COVID19 will only further cripple the system. https://t.co/oJMsysqZJ8",alex5silver2,['COVID19'],224
2020-02-19 10:50:05,@andreasharsono Stop with #COVID19 nonsense. It is #MadeInChinaVirus,SheraAlUzza,"['COVID19', 'MadeInChinaVirus']",410
2020-02-19 10:50:00,"Working with US preparedness authority BARDA, @sanofipasteur, the vaccines global arm of French drugmaker @sanofi, will leverage its recombinant technology platform to help expedite a potential #COVID19 vaccine. #coronavirus https://t.co/w8qsauZwKi",CHEManager_EU,"['COVID19', 'coronavirus']",3197
2020-02-19 10:49:58,COVID-19 scare and make it FASHION! 🤣💃🏻 #NCov #Covid19 #Covid19SG https://t.co/iuPgxPjRmS,noypreneur,"['NCov', 'Covid19', 'Covid19SG']",62
2020-02-19 10:49:35,"Delta proactively reaches out to customers who were onboard d same flight w/ Japanese couple who visited Hawaii &amp; were diagnosed w/ #coronavirus upon returning home.  The 10 hrs Delta Flight 611 left Honolulu on Feb 6, landed in Nagoya on Feb 7.  #COVID19  https://t.co/lhIutvMozt",putuliza,"['coronavirus', 'COVID19']",608
2020-02-19 10:49:31,#WHO sends #coronavirus test kits to African nations after first case confirmed https://t.co/IYbpQAHMe7 via @scmpnews #Africa #COVID19 #2019nCoV #coronavirusoutbreak #publichealth,davi326,"['WHO', 'coronavirus', 'Africa', 'COVID19', '2019nCoV', 'coronavirusoutbreak', 'publichealth']",2742
2020-02-19 10:49:30,1 new death in #HongKong 20 new cases in #SouthKorea 3 new cases in #Japan 2 have recovered in #Malaysia (local)  #COVID19 latest: - 75227 cases - 2012 deaths - 14921 recovered - 2.7% fatality rate - 30 places  https://t.co/CAdnjmRQPi  #KeepMeSafe from #CoronaVirus #WuhanVirus https://t.co/hlQCErkvkz,KeepMeSafeApp,"['HongKong', 'SouthKorea', 'Japan', 'Malaysia', 'COVID19', 'KeepMeSafe', 'CoronaVirus', 'WuhanVirus']",3
