title_text,Time_stamp,source
"Europe could see other surprise coronavirus outbreaks like Italy's, WHO chief warns",2020-03-01T13:33:44Z,cnbc
Goldman Sachs sees three coronavirus market scenarios,2020-03-01T19:08:43Z,cnbc
'We knew this was coming': Biden criticizes Trump administration's coronavirus response,2020-03-01T15:36:16Z,cnbc
Awaiting US stock futures open at 6 pm after Wall Street's worst week since 2008,2020-03-01T21:27:18Z,cnbc
CERAWeek energy conference canceled over concerns about coronavirus outbreak,2020-03-01T17:54:01Z,cnbc
"More than 15,000 coronavirus testing kits are on the way to health professionals, Pence says",2020-03-01T14:58:00Z,cnbc
Asia stocks set to fall as Chinese manufacturing activity plunges below expectations,2020-03-01T23:35:00Z,cnbc
United postpones new pilot class amid coronavirus outbreak,2020-03-01T17:34:14Z,cnbc
Virus recession? Top economist Ed Hyman sees zero US growth the next two quarters,2020-03-01T21:09:22Z,cnbc
A full analysis of the market turmoil: What Wall Street pros are watching before jumping back in,2020-03-01T22:01:07Z,cnbc
Markets Sunday live updates: Awaiting stock futures open,2020-03-01T20:57:00Z,cnbc
"Coronavirus poses 'significant threat' to Trump's re-election, top economist Mark Zandi says",2020-03-01T22:01:00Z,cnbc
'This is truly a nightmare': How one businesswoman's flight to China ended in coronavirus quarantine,2020-03-01T18:28:00Z,cnbc
Coronavirus live updates: China reports 573 new cases,2020-03-01T01:17:00Z,cnbc
"JPMorgan, Citi and Goldman Sachs all believe there hasn't been enough pain to call a bottom yet",2020-03-01T21:47:03Z,cnbc
"Coronavirus live updates: Australia, Thailand and US report first deaths over weekend",2020-03-01T13:46:26Z,cnbc
WHO chief on coronavirus: Global markets 'should calm down and try to see the reality',2020-03-01T08:17:11Z,cnbc
Thomson Reuters halts employee travel to China and South Korea over coronavirus outbreak,2020-03-01T20:24:56Z,cnbc
Kelly Evans: Cash for coronavirus,2020-03-02T15:57:24Z,cnbc
Watch live: New York officials hold press conference on state's first coronavirus case,2020-03-02T13:43:31Z,cnbc
Treasury yields mixed as investors monitor coronavirus response,2020-03-02T06:31:36Z,cnbc
Here's why the coronavirus may clobber your retirement plans,2020-03-02T18:22:39Z,cnbc
The coronavirus outbreak could mean no summer vacations this year,2020-03-02T12:23:04Z,cnbc
NASA images show 'significant decreases' in air pollution over China amid coronavirus economic slowdown—take a look,2020-03-02T17:16:52Z,cnbc
"El-Erian lifts his don't-buy-the-dip warning for pros, but says most investors should still wait",2020-03-02T13:41:24Z,cnbc
What to watch: Dow set for another coronavirus-driven drop as Wall Street hopes for Fed help,2020-03-02T12:47:08Z,cnbc
"Trump knocks Fed for not cutting: 'As usual, Jay Powell and the Federal Reserve are slow to act'",2020-03-02T14:19:22Z,cnbc
Here's what happened to the stock market on Monday,2020-03-02T20:09:34Z,cnbc
Robinhood says it's experiencing a 'system-wide outage' as markets rebound in heavy volume Monday,2020-03-02T13:49:40Z,cnbc
This new rule could change how annuities are sold,2020-03-02T19:47:42Z,cnbc
"Stock market live updates: Dow futures down 200, traders search for the bottom",2020-03-02T12:28:00Z,cnbc
Oppenheimer upgrades Apple amid the coronavirus sell-off: Buy the 'recurring revenue machine',2020-03-02T12:20:00Z,cnbc
"These stocks should benefit from the coronavirus 'pantry-load panic,' Jefferies says",2020-03-02T13:50:00Z,cnbc
"Iran's coronavirus updates cannot 'entirely' be trusted, expert says",2020-03-02T09:48:00Z,cnbc
First coronavirus case confirmed in New York City,2020-03-02T01:49:00Z,cnbc
Leon Cooperman's advice to regular investors during this market sell-off,2020-03-02T01:20:00Z,cnbc
"Wharton's Jeremy Siegel sees a 'short, quick recession' due to the coronavirus",2020-03-02T14:25:00Z,cnbc
"Coronavirus live updates: Asia markets set to fall, Macao casino revenue plunges",2020-03-02T00:09:00Z,cnbc
What to watch today: Dow to drop after Monday's huge gain as morning G-7 statement disappoints,2020-03-03T12:40:32Z,cnbc
"Buy Uber into the coronavirus travel fears, Needham says",2020-03-03T12:01:44Z,cnbc
Some schools are closing because of coronavirus —here's what the Department of Education is saying,2020-03-03T17:35:54Z,cnbc
Bill Ackman is hedging big time because of the 'substantial negative impact' from the coronavirus,2020-03-03T21:18:28Z,cnbc
European stocks signal higher open on stimulus hopes,2020-03-03T04:56:01Z,cnbc
Does your credit card travel insurance cover coronavirus cancellations?,2020-03-03T18:44:06Z,cnbc
"These media stocks are coronavirus safe-havens, Wells Fargo says",2020-03-03T17:17:27Z,cnbc
Regeneron CEO hopes to have coronavirus treatment ready for human testing possibly by this summer,2020-03-03T20:23:42Z,cnbc
How this Canadian start-up spotted coronavirus before everyone else knew about it,2020-03-03T14:27:47Z,cnbc
Apple iPhone partner Foxconn predicts it will be back to full capacity by the end of the month,2020-03-03T13:43:30Z,cnbc
Kelly Evans: No Shock and No Awe,2020-03-03T15:41:40Z,cnbc
North Carolina confirms state's first case — a resident who was visiting Washington,2020-03-03T20:08:24Z,cnbc
Suze Orman: There is a retirement 'crisis.' Here are strategies for those 50 and over,2020-03-03T13:52:46Z,cnbc
Morgan Stanley's Mike Wilson says he doesn't want stocks to snap back tomorrow,2020-03-03T23:29:12Z,cnbc
"Here are Tuesday's biggest analyst calls of the day: Tesla, UPS, Uber, Disney & more",2020-03-03T12:57:35Z,cnbc
"Coronavirus live updates: Japan indicates Olympics could be delayed, Trump calls for rate cut",2020-03-03T12:52:00Z,cnbc
"Amazon, Walmart and others battle price gouging on coronavirus-related products",2020-03-03T16:15:00Z,cnbc
The 'stranded employee' is a coronavirus problem the work world has never seen,2020-03-03T13:01:00Z,cnbc
"Pope tests negative for coronavirus, Italy report says",2020-03-03T07:38:00Z,cnbc
Italy's hospitals reach breaking point as Rome splashes cash to help virus-hit economy,2020-03-03T09:21:00Z,cnbc
"Dollar on defensive as rate cut spooks markets, yields slide - CNBC",2020-03-04T01:10:00Z,cnbc
Fed cuts interest rates 50 basis points to combat coronavirus — here's what it means for your credit card,2020-03-04T17:06:20Z,cnbc
"Italy's coronavirus outbreak now looks worse than Iran's, as infections and deaths keep rising",2020-03-04T09:09:47Z,cnbc
Watch: Coronavirus task force holds press briefing as US death toll rises,2020-03-04T19:49:01Z,cnbc
UAE takes steps to curb the coronavirus spread including shutting schools for four weeks,2020-03-04T10:36:26Z,cnbc
"When working from home isn't an option, these resources can help workers avoid coronavirus",2020-03-04T20:01:48Z,cnbc
"Sony Pictures temporarily shuts London, Paris and Gdynia offices over coronavirus",2020-03-04T16:01:23Z,cnbc
"What to watch today: Dow to rebound, Biden's comeback and coronavirus mortality rate rises",2020-03-04T12:41:50Z,cnbc
Coronavirus highlights the inequality of who can — and can't — work from home,2020-03-04T20:50:16Z,cnbc
"JPMorgan calls Lyft 'extremely compelling at current levels,' with little risk from coronavirus",2020-03-04T14:26:14Z,cnbc
JPMorgan believes this name is coronavirus-proof and 'Big Short's' Eisman likes it too,2020-03-04T13:42:27Z,cnbc
"These high quality stocks bounce back the fastest after a market sell-off, Bernstein says",2020-03-04T13:26:00Z,cnbc
Kelly Evans: A moment of silence for the 10-year,2020-03-04T15:59:06Z,cnbc
Options trader wins big on a Super Tuesday health-care bet,2020-03-04T16:31:10Z,cnbc
Op-Ed: Biden has one thing to thank for his resurgence: Fear,2020-03-04T13:45:31Z,cnbc
European markets to open slightly higher as investors monitor virus spread and Fed's surprise cut,2020-03-04T05:31:00Z,cnbc
How to talk about money in a marriage — before it's too late,2020-03-04T12:01:01Z,cnbc
Tory Burch: 'I got my fair share of patronizing pats on the back when starting out',2020-03-04T16:01:01Z,cnbc
"Oil rises as OPEC, allies work on big cut - CNBC",2020-03-04T11:57:00Z,cnbc
"Google is showing ads for anti-coronavirus products, despite policy banning them",2020-03-04T23:01:00Z,cnbc
Watch: Army officials to address coronavirus efforts at the Pentagon,2020-03-05T17:43:29Z,cnbc
"Cut flights, unpaid leave and hiring freezes: Airlines race to stem impact from coronavirus",2020-03-05T16:41:16Z,cnbc
European stocks set to open higher after $50 billion IMF pledge to fight virus,2020-03-05T05:07:20Z,cnbc
"GE warns on coronavirus, but charts point to double-digit rally ahead",2020-03-05T13:31:07Z,cnbc
Quest Diagnostics will start testing for the coronavirus,2020-03-05T14:35:41Z,cnbc
"At airlines, a coronavirus cash crunch unlike previous travel disruptions",2020-03-05T16:47:00Z,cnbc
"Starbucks says China business is recovering, but second-quarter will take hit to sales from coronavirus closures",2020-03-05T21:45:24Z,cnbc
"What to watch today: Dow to sink after Wednesday's 1,100-point surge with focus on coronavirus",2020-03-05T12:36:56Z,cnbc
Earnings estimates are plummeting in Europe. Here's what that means for the US,2020-03-05T11:05:58Z,cnbc
Here's what to do if you are boarding a plane in the age of coronavirus,2020-03-05T16:45:25Z,cnbc
10-year Treasury yield holds above 1% after stock surge and coronavirus support package,2020-03-05T06:11:37Z,cnbc
"Kelly Evans: FEMA, not the FOMC",2020-03-05T15:50:32Z,cnbc
"Stocks making the biggest moves midday: American Airlines, Apple, Uber, FireEye & more",2020-03-05T18:57:17Z,cnbc
"FireEye headed towards 'improvement,' Goldman says in upgrade",2020-03-05T13:33:09Z,cnbc
Twitter CEO Jack Dorsey is reconsidering his Africa move given coronavirus fears 'and everything else going on',2020-03-05T17:38:15Z,cnbc
"Health care can still climb back to all-time highs, chart suggests — here are the stocks traders are buying",2020-03-05T11:06:46Z,cnbc
Asia stocks set to drop in week of market gyrations,2020-03-05T22:49:38Z,cnbc
"It's time to bet on risky cyclical stocks, top JPMorgan strategist says",2020-03-05T19:13:44Z,cnbc
"Stocks making the biggest moves after hours: American Outdoor Brands, H&R Block, Okta and more",2020-03-05T21:49:41Z,cnbc
Democratic Wall Street powerbroker thinks Biden can beat Sanders 'but I would not bet my life',2020-03-05T16:42:55Z,cnbc
European stocks set to open lower amid coronavirus volatility,2020-03-06T04:58:07Z,cnbc
The coronavirus could actually make working from home more commonplace,2020-03-06T14:10:16Z,cnbc
People are stocking up on food and essentials during coronavirus hysteria—and it's leading to spikes in sales for some interesting products,2020-03-06T20:50:15Z,cnbc
10-year Treasury yield falls below 0.83% as coronavirus rocks markets,2020-03-06T05:48:00Z,cnbc
Can going cashless prevent coronavirus spread? Here's what WHO wants you to know,2020-03-06T14:42:53Z,cnbc
"What to watch today: Dow to sink again, Pompeo slams China over coronavirus and February jobs soar",2020-03-06T12:44:27Z,cnbc
"Coronavirus will trigger widespread emerging market rate cuts and boost equities, analysts predict",2020-03-06T12:53:55Z,cnbc
"Here are Friday's biggest analyst calls of the day: Lyft, Chipotle, BJ's & more",2020-03-06T12:42:19Z,cnbc
Kudlow: 'Long term investors should think seriously about buying these dips',2020-03-06T14:22:50Z,cnbc
You might be tempted to move to safer 401(k) assets amid coronavirus market swings. What to know before you shift your money,2020-03-06T12:01:01Z,cnbc
"If you invested $1,000 in Nordstrom 10 years ago, here's how much you'd have now",2020-03-06T18:59:59Z,cnbc
"People are stealing face masks and other medical equipment from hospitals, New York Gov. Cuomo says",2020-03-06T19:15:00Z,cnbc
Y Combinator moves signature startup pitch event online amid coronavirus concerns,2020-03-06T19:47:00Z,cnbc
Here's Credit Suisse's best offensive and defensive plays in the wild market climate,2020-03-06T13:12:00Z,cnbc
"Stock market live updates: Sell-off intensifies, Dow set for 500-point drop, 10-year sinks",2020-03-06T12:17:00Z,cnbc
The market now sees the Fed cutting by 75 basis points in March,2020-03-06T19:02:00Z,cnbc
"Expect Sales To Increase In Areas Outside Travel And Leisure Amid Coronavirus Outbreak, Says John Taylor",2020-03-06T10:09:00Z,cnbc
Wall Street traders head to the suburbs as Citigroup joins other banks taking coronavirus precaution,2020-03-06T18:32:36Z,cnbc
"Traders caution against buying travel stocks: 'When in doubt, stay out'",2020-03-06T11:57:48Z,cnbc
Iran minister accuses 'some countries' of not declaring their coronavirus cases,2020-03-06T10:08:18Z,cnbc
Should you skip the gym or a workout class because of the coronavirus outbreak?,2020-03-07T13:01:01Z,cnbc
"Analysts upgraded these stocks, saying they're safe from the coronavirus outbreak",2020-03-07T12:12:54Z,cnbc
Analysts say the coronavirus outbreak won't hurt the stock that Stifel calls 'The Terminator',2020-03-07T12:06:17Z,cnbc
How to afford your favorite vices without going broke,2020-03-07T14:36:01Z,cnbc
What is a medical credit card—and should I use one?,2020-03-07T13:00:01Z,cnbc
This hedge fund billionaire owns the most expensive home ever sold in America — here's how he spends his fortune,2020-03-07T13:31:01Z,cnbc
Leader of Italy's co-ruling democratic party tests positive for coronavirus,2020-03-07T12:20:00Z,cnbc
NBA advises teams to prep contingency plans for games without fans due to coronavirus,2020-03-07T05:40:00Z,cnbc
Amtrak suspends nonstop Acela service between DC and New York due to coronavirus,2020-03-07T16:33:00Z,cnbc
"Facebook, Google giving cash to Silicon Valley communities affected by coronavirus cancellations",2020-03-07T15:12:00Z,cnbc
"Everything Jim Cramer said about the stock market on 'Mad Money,' including coronavirus and corporate earnings, stay-at-home plays",2020-03-07T01:42:48Z,cnbc
Cramer's week ahead: Corporate earnings will play a back seat to coronavirus,2020-03-07T00:27:01Z,cnbc
Jim Cramer: 20 stock picks for the 'stay-at-home economy',2020-03-07T00:31:19Z,cnbc
Stressed stock market may need to retest its lows before finding its footing in the coronavirus crisis,2020-03-07T13:07:26Z,cnbc
Op-Ed: The coronavirus outbreak is already changing the world,2020-03-07T18:04:56Z,cnbc
When you sell during a panic you may miss the market's best days,2020-03-07T13:00:58Z,cnbc
Coronavirus live updates: Pope cancels major public appearances as cases surge in Europe,2020-03-07T14:19:05Z,cnbc
"Facebook temporarily bans ads, listings for medical face masks amid coronavirus outbreak",2020-03-07T02:55:28Z,cnbc
"China January-February exports tumble, imports slow as coronavirus batters trade and business",2020-03-07T04:44:52Z,cnbc
Florida says 2 residents have died from coronavirus,2020-03-07T04:11:35Z,cnbc
